1,强烈要求严查湖北上下官员失职渎职不作为的情况，现在感染源都扩散到全国了，官员们还有闲心开晚会，医生护士连防护都不足，拿什么抢救病人？拿什么保护自己？为什么湖北严重到这个程度，措施还比不上隔壁河南？同样的政策别人十二月都出了，湖北在干什么？
1,希望关注一下武汉的独居老人他们有的没有信息来源并且口罩购买途径也基本没有口罩也抢不过年轻人武汉被封城也不一定知道老人家是易感人群抵抗力也弱拜托一定要给独居老人发放口罩和宣传册
1,湖北省春节团拜会文艺演出在武汉洪山礼堂举办，湖北省委书记、省长等领导与全省各界代表一同到场观。看了演出湖北省民族歌舞团40多名演职人员参与了多个节目的演出，营造出喜庆、欢快、奋进的良好节日氛围，演出得到省领导的充分肯定，也得到现场观众的广泛好评。
1,希望还是由中央统一调度指挥吧，对某些省政府不抱希望
1,中央接手吧，湖北，武汉指不定拿钱干出什么憨比事情
1,希望能到真正有需要的地方去，落实到实处
1,建议直接拨物资，应该真的很需要
1,赶紧医护用品物资跟上
1,先调物资好吗医生防护服护目镜这些比钱更实在
1,给环卫工人们也发一下口罩啊！！！还有独居老人！！！请关注一下老人们啊
1,贪官污吏这个时候要是还敢伸手原地爆炸
1,湖北省的领导班子21号还在看文艺演出，那些领导真是对不起去一线奋战的各路医护人员！祝憨批领导们早日下台
1,例如汉口医院这种小一点的医院麻烦看看啊！
1,强烈要求严查湖北上下官员失职渎职不作为的情况，现在感染源都扩散到全国了，官员们还有闲心开晚会，医生护士连防护都不足，拿什么抢救病人？拿什么保护自己？为什么湖北严重到这个程度，措施还比不上隔壁河南？同样的政策别人十二月都出了，湖北在干什么？
1,湖北人配，湖北官员配？
1,湖北省春节团拜会文艺演出在武汉洪山礼堂举办，湖北省委书记、省长等领导与全省各界代表一同到场观。看了演出湖北省民族歌舞团40多名演职人员参与了多个节目的演出，营造出喜庆、欢快、奋进的良好节日氛围，演出得到省领导的充分肯定，也得到现场观众的广泛好评。
1,这层层剥削下来又有多少
1,拨款10亿给政府？？？中央没疯吧？别人酒还没醒等等一激动就过去了
1,现在最主要的就是物资紧缺希望国家能帮忙
1,希望资金使用能够公开透明！！！湖北官员近期的种种作为，真的让人很不放心！！！
1,拨款用途公开！！！！！！
1,武汉不要担心啦，祖国妈妈和其他小朋友会帮你擦干眼泪的
1,跳舞的妹子她好看吗？
1,中央直接指挥吧某些政府真的无作为
1,那些年入上亿的明星朋友呢
1,请关注武汉周边城市！！！我看评论已经有很多人在说这个事了，武汉已经那么严重了，包括外省也有很多感染的，离武汉更近的城市怎么可能会没有？！恳请多关注一下武汉周边城市！男朋友也在荆门那边，真的很担心啊！
1,花给医生花给医院花到物资上别入了看表演人的口袋
1,建议中央直接插手去管，我真害怕他们拿这10个亿出去吃喝玩乐
1,恩施恩施恩施恩施恩施恩施恩施恩施恩施恩施恩施恩施恩施口罩贵死了口罩贵死了口罩贵死了口罩贵死了口罩贵死了口罩贵死了口罩贵死了口罩贵死了口罩贵死了口罩贵死了
1,关注医务人员物资短缺问题！！！关注武汉孤单老人安全问题！！
1,谁敢贪污立马下地狱永世不得超生!
1,财政部，中央干活了。那地方政府呢？装死吗
1,不理解那些连夜逃出武汉的。身体有病，脑子也病了吗？早发现早治疗，还免费，您乱跑除了害人害己，还能干啥？
1,中央直接接管吧，别这10亿又给湖北省长去看联欢晚会了
1,国家花10亿给你吃野味
1,国家花钱为愚蠢买单！！！
1,请求中央派有能力的人去湖北指挥！！！
1,强烈要求严查湖北上下官员失职渎职不作为的情况，现在感染源都扩散到全国了，官员们还有闲心开晚会，医生护士连防护都不足，拿什么抢救病人？拿什么保护自己？为什么湖北严重到这个程度，措施还比不上隔壁河南？同样的政策别人十二月都出了，湖北在干什么？
1,为什么海鲜市场会有非法销售野味的，各位武汉的领导们？
1,10亿？相信我，绝对会有人贪污的，别问为什么，
1,领导们真是感动中国了冒着生命危险还去看歌舞表演看完了吗现在能出来办正事了吗
1,给东西给东西求求了，我真的不相信这个湖北的领导
1,求求你关注一下老年人，真的尤其是独居老人求求你了
1,看看孝感吧孝感孝感孝感孝感孝感孝感孝感孝感孝感孝感孝感孝感孝感孝感孝感孝感孝感孝感孝感孝感孝感孝感孝感孝感孝感孝感
1,不要被贪官贪污了
1,资金去向请务必落实到位
1,湖北省宜昌市现在什么情况？有多少感染？会不会封城？？能不能给个官方消息啊啊啊啊啊
1,要是这笔钱被某些官员贪污了，我就我就哭给你看！
1,这个钱如果是被贪了那真就失望了
1,买防护用品啊
1,让领导班子掏钱赔付吧
1,建议立法将捕捉野生动物的人抓起来吃野生动物的人也治罪！他们才是罪魁祸首！你伤害自然大自然终究一天会害你！我们生存在这世界上已经是大自然对我们的恩赐而有些人却要这样伤害它！遭因果报应这是必然的人的欲望无穷尽但也请有底线！经济抓好是为了生活更幸福但人性偏了国家怎会持续富强！
1,能不能管管上海？？？数据也不更新政府还没作为
1,我们这些小县城也需要重视一下的
1,:能关注一下湖北其他地级县市吗？黄冈鄂州也封城了，别忘记他们啊……
1,湖北省春节团拜会文艺演出在武汉洪山礼堂举办，湖北省委书记、省长等领导与全省各界代表一同到场观。看了演出湖北省民族歌舞团40多名演职人员参与了多个节目的演出，营造出喜庆、欢快、奋进的良好节日氛围，演出得到省领导的充分肯定，也得到现场观众的广泛好评。
1,感动中华儿女
1,zf领导们求求你们做个人吧打赢这场战役你们必须要有行动啊！！！
1,其实普通百姓关心这笔钱别进了湖北官员们的口袋
1,但愿别贪国难钱
1,有个疑问，这么长时间瞒着不报为什么？单单是为了乌纱帽？全城逃出去近30万人，那领导的家属呢？他们是否早就转移了？有可能会转移到美国吗？财产呢？顶我上去，我们大家得好好想想
1,物资也请充足，不能让武汉的朋友心寒。祖国没有人要放弃他们，也绝不会放弃非重区其实没必要屯太多n95，普通医用口罩ok了，武汉和湖北其他地区的朋友比我们更需要n95.除了买菜年货别外出，不给社会增加负担，相信我们一定能共渡难关的
1,湖北省春节团拜会文艺演出在武汉洪山礼堂举办，湖北省委书记、省长等领导与全省各界代表一同到场观。看了演出湖北省民族歌舞团40多名演职人员参与了多个节目的演出，营造出喜庆、欢快、奋进的良好节日氛围，演出得到省领导的充分肯定，也得到现场观众的广泛好评。
1,这钱我估计一半是给现在还有闲心看歌舞的领导们的压惊费（他们自封的）。
1,湖北加油湖北加油湖北加油湖北加油湖北加油湖北加油湖北加油湖北加油湖北加油湖北加油湖北加油湖北加油湖北加油湖北加油湖北加油湖北加油湖北加油湖北加油湖北加油湖北加油
1,谁要是贪一分这个钱谁全家bbiss。
1,多补点物资吧，这么多钱弄下来，一层层政府官员也不知道弄到谁口袋里去了……
1,希望专款专用
1,湖北数据为什么还不更新？？？
1,希望资金到位同时用到刀刃上，真的不希望被人毕竟wh领导班子一群憨憨
1,希望关注一下武汉的独居老人他们有的没有信息来源并且口罩购买途径也基本没有口罩也抢不过年轻人武汉被封城也不一定知道老人家是易感人群抵抗力也弱拜托一定要给独居老人发放口罩和宣传册
1,强烈要求严查湖北上下官员失职渎职不作为的情况，现在感染源都扩散到全国了，官员们还有闲心开晚会，医生护士连防护都不足，拿什么抢救病人？拿什么保护自己？为什么湖北严重到这个程度，措施还比不上隔壁河南？同样的政策别人十二月都出了，湖北在干什么？
1,吃野味的那些人死了吗？！
1,湖北黄石黄石黄石黄石黄石！！看看黄石！！看看黄石！！看看黄石！！看看黄石！！看看黄石！！看看黄石！！看看黄石！！1917例发热10例疑似！！距离武汉半小时车程！！看看黄石吧
1,为什么海鲜市场会有非法销售野味的，各位武汉的领导们？
1,湖北省春节团拜会文艺演出在武汉洪山礼堂举办，湖北省委书记、省长等领导与全省各界代表一同到场观。看了演出湖北省民族歌舞团40多名演职人员参与了多个节目的演出，营造出喜庆、欢快、奋进的良好节日氛围，演出得到省领导的充分肯定，也得到现场观众的广泛好评。
1,但求全国大学也推迟开学吧
1,问武汉23号早上都封城了！21号的湖北领导在武汉干嘛？答趁着疫情，人相对少，一起去典礼大堂撒欢
1,强烈要求严查湖北上下官员失职渎职不作为的情况，现在感染源都扩散到全国了，官员们还有闲心开晚会，医生护士连防护都不足，拿什么抢救病人？拿什么保护自己？为什么湖北严重到这个程度，措施还比不上隔壁河南？同样的政策别人十二月都出了，湖北在干什么？
1,吃野味的biss
1,别TM吃了艹
1,但凡那么几个憨批管住自己的b嘴不吃野味也不至于全国乃至全世界为他们善后
1,老祖宗全都帮你试过了，把最好吃的肉全都驯养了，古代死亡率为什么那么高？瘟疫那么多人，全是吃野生动物携带病毒弄的，吃什么野味，复古了吗？
1,湖北省春节团拜会文艺演出在武汉洪山礼堂举办，湖北省委书记、省长等领导与全省各界代表一同到场观。看了演出湖北省民族歌舞团40多名演职人员参与了多个节目的演出，营造出喜庆、欢快、奋进的良好节日氛围，演出得到省领导的充分肯定，也得到现场观众的广泛好评。
1,求透明通报湖北其他地级市！求透明通报湖北其他地级市！求透明通报湖北其他地级市！求透明通报湖北其他地级市！求透明通报湖北其他地级市！求透明通报湖北其他地级市！求透明通报湖北其他地级市！求透明通报湖北其他地级市！透明通报湖北其他地级市！孝感天门潜江仙桃宜昌荆门襄阳鄂州黄冈咸宁随州十堰
1,。。。摊位上分离出病毒也太吓人了吧那不是随地都是？？
1,拜托关注一下武汉的独居老人他们有的没有信息来源并且口罩购买途径也基本没有口罩也抢不过年轻人武汉被封城也不一定知道老人家是易感人群抵抗力也弱拜托一定要给独居老人发放口罩和宣传册！！！⚠️
1,小学数学老师说过一句话:“吃吃吃！吃死你！！”
1,打扰了请大家关注下！湖北荆门公职人员车祸肇事！殴打医护人员！带头伤医！妻子前线抗疫！丈夫救人被医闹逼迫下跪！仅罚500拘留5天！
1,我想问问现在武汉快递是什么情况阿，买的口罩进的来吗，我买的全不发货，一买完就下架…或者姐妹们有没有可以快速发货的口罩链接阿
1,武汉封城后的市民生活！湖北省领导班子冒着生命危险观看文艺汇演，感动中国!​
1,湖北省春节团拜会文艺演出在武汉洪山礼堂举办，湖北省委书记、省长等领导与全省各界代表一同到场观。看了演出湖北省民族歌舞团40多名演职人员参与了多个节目的演出，营造出喜庆、欢快、奋进的良好节日氛围，演出得到省领导的充分肯定，也得到现场观众的广泛好评。
1,武汉领导还有心看联欢会呢？
1,卧槽！真的骂死吃野味的那些人！怎么没把他吃死呢！害全国各地无辜百姓！本来好好的一个团圆日子，现在只能在恐慌的情绪中度过！
1,人民日报的工作人员们你们好！麻烦可以登报一下江西情况吗？江西政府完全看不到措施   麻丘回来南昌两千余人务农工也没人核实真假    很多地方都有感染者  江西政府却不上报  不调查不宣传  无措施   麻烦人民爸爸关注一下我们江西  救救我们江西   不要放弃我们啊！！事情很严重！！
1,救救大家！！！！！
1,还TM吃还TM吃还TM吃还TM吃还TM吃还TM吃还TM吃还TM吃还TM吃还TM吃还TM吃还TM吃还TM吃还TM吃还TM吃还TM吃还TM吃还TM吃还TM吃还TM吃还TM吃还TM吃还TM吃还TM吃
1,为了一时的口腹之欲全国人民都要跟着遭殃!
1,买不到口罩买不到口罩买不到口罩买不到口罩买不到口罩买不到口罩买不到口罩买不到口罩买不到口罩买不到口罩买不到口罩我在随州，距离武汉2个小时车程，我好害怕
1,希望疫情早日得到有效控制，病毒早日褪去吧……自此以后人类就别再吃野味了吧！！！祈祷所有的医护人员和病患者望平安
1,真的一天了，看着疫情，看着医生护士还有微博上住不进医院的求助，那群吃野味没开化的野人能不能滚去统统si干净啊！！！
1,大部分人类的灾难造成的原因，总有一部分人类愚昧无知！肆无忌惮！对自然和生命没有基本的敬畏心！这些账都被自然一笔笔记下，一报还一报，这都是自然给人类的惩罚。
1,人类报之以油盐酱醋，动物还之以病毒杂症
1,市场监管在哪里？工商部门在哪里？卫生防疫部门在哪里？武汉市政府在哪里？这些野味明目张胆的在市场上明码标价？！你们的做为在哪里？
1,那些管不住嘴巴乱吃野生动物的给全国人民跪地道歉
1,刚刚做了一个武汉需要捐赠医疗物资的联系方式汇总，还有武汉协和医院今天首发的抗击武汉新型冠状病毒中医解决方案，请去我的微博查看并扩散，将有效信息传递出去，让欠缺的物资早日得以补全
1,这波疫情完了之后，建议对这群买、卖以及中间经手的人，十倍严格追责！！！！
1,为了吃真的连命都不要了
1,靠吃野味找优越感？？？不过如此啊他们
1,辛苦你们啦，再次谴责那些破坏生态环境的人！！！！
1,湖北不只有武汉
1,为什么不爱护野生动物呢
1,顺便问一下武汉第一批吃野味住院的患者，怎么样了？​
1,吃吃吃吃你
1,拒绝野生动物，管住自己的嘴
1,保护动物，便是保护自己。从我做起，与野味sayNO
1,基本实锤了，这么真实的教训，不知是否可以给吃野味的人一记耳光，牢记这场悲剧。
1,哎呦越来越气
1,吃吃吃吃死你，不管谁自己死记得烧成灰别拖上别人
1,吃野味的建议嘴巴缝上，下半生靠流食度日，不是爱吃嘛，这辈子都别想了
1,吃野味给老子死吧？！
1,湖北省政府牛逼
1,枪毙这些无良商人
1,谁敢吃枪毙
1,不要因为贪图一时的享乐，让全世界人民买单！拒绝野味，从我做起！
1,吃野生动物的原地爆炸
1,03年非典就瞎吃吃出来的，还不长记性！吃什么吃，野生动物携带各种致病病毒，真是无知者无畏！让全国人给你们善后，良心不会痛吗
1,别吃了别吃了别吃了别吃了别吃了别吃了别吃了别吃了别吃了别吃了别吃了别吃了别吃了别吃了
1,证据确凿，有理说理
1,职能部门干吗使的
1,应该是  应该是  注意不是一定！！！
1,请求国家加强一线医生的防护，我一个怀孕六个月的医生，每天奋战在一线，不敢请假，因为同事已经病倒，人员完全不足，但是我们唯一的防护却只有普通的一次性口罩和帽子，说好的隔离衣、防护服、护目镜、面罩等呢？
1,卖的商贩那些应该也带了病毒吧？！赶紧把他们隔离起来吧！
1,2020，多么美好的一年，却因个别人吃野味给全国乃至全人类带来这么大的伤害，请求吃野味入刑！！！！！！
1,本来可以开开心心的迎接20年代的到来，结果因为这些吃野味的憨批，全国人民跟着遭罪！！！
1,一群吃野味的和卖野味的，导致全国人民买单，这次疫情过后真的要立法，不准售卖、吃野味，抓到要严惩一个大国经不起这些人折腾
1,所以现在回来看怎么说？？？
1,高蝙蝠，第一时间去武汉搜集数据发表sci，不和武汉研究所人员合作，这种人眼里只有名利。
1,求求大学生延迟开学吧，坐车要去贵阳，经过温州，杭州……等，位于嘉兴的我，真的瑟瑟发抖，离上海也近
1,现在都还有吃野味的憨批狡辩呢
1,强烈要求严查湖北上下官员失职渎职不作为的情况，现在感染源都扩散到全国了，官员们还有闲心开晚会，医生护士连防护都不足，拿什么抢救病人？拿什么保护自己？为什么湖北严重到这个程度，措施还比不上隔壁河南？同样的政策别人十二月都出了，湖北在干什么？
1,湖北省春节团拜会文艺演出在武汉洪山礼堂举办，湖北省委书记、省长等领导与全省各界代表一同到场观。看了演出湖北省民族歌舞团40多名演职人员参与了多个节目的演出，营造出喜庆、欢快、奋进的良好节日氛围，演出得到省领导的充分肯定，也得到现场观众的广泛好评。
1,说一下！且不说大学生专业一起上大课就是最大的聚集性活动了！还有食堂吃饭、浴室洗澡……而且全国各地高校那么多大学生那么多，难免有什么隐患！望重视！
1,我想问问湖北省委们晚会好看吗
1,在武汉不到一天，虽然没去人流量多的地方，但毕竟也转乘了，今天第八天了没有异样，我现在就是自己一个人自行隔离，朋友怎么约都婉拒，对别人负责。
1,请关注下武汉周边城市吧！！！周边城市都是乡镇，防范意识差，而且都是武汉回老家过年的人，求政府重视
1,身为武汉大学生，回家已经过了14天。前天晚上去医院验血，结果正常。在家每天戴口罩，尽量不出门，一天用杀菌洗手液洗手三次。主动排除一点点的可能性，也是我们能做到的最大的支持了。武汉加油！！！
1,如果您来自疫区，您曾到过武汉，或接触过从武汉回来者，尽量不去接触别人，持续观察自己的健康状况14天！请自觉居家观察14天！这是一种觉悟，更是一种责任，也关乎您和您家人的健康！
1,不理解那些连夜逃出武汉的。身体有病，脑子也病了吗？早发现早治疗，还免费，您乱跑除了害人害己，还能干啥？
1,帮下武汉医务人员啊，他们缺口罩，他们缺口罩，武汉政府一点也不办事，他们都打好多电话了，都没有口罩，求求了，给他们送点口罩去吧
1,我怕被传染，也怕传染给别人，所以选择今年一个人在武汉过年了
1,恶意逃离武汉，造成新型冠状病毒传播的，可能构成犯罪！
1,可不可以关注一下武汉周边的县市！距武汉市中心约60公里、机场30公里、城铁（孝感东-汉口）最快只需26分钟的孝感，至今只今天傍晚发布的22日的（发热1200例，高度疑似9例）！！！临沂的两例确诊来自孝感…孝感的官方新闻媒体不公布最新数据、关闭微博评论、今天上午还在微博倡导走亲访友多选公共交通…
1,刚收到消息离家一公里之内的有两个从武汉回来的，其中一个还是老人。心态崩了
1,强烈要求严查湖北上下官员失职渎职不作为的情况，现在感染源都扩散到全国了，官员们还有闲心开晚会，医生护士连防护都不足，拿什么抢救病人？拿什么保护自己？为什么湖北严重到这个程度，措施还比不上隔壁河南？同样的政策别人十二月都出了，湖北在干什么？
1,家里老人还是不听啊！三大运营商能不能发个提醒短信、我已经绝望了小县城还有好多回来的大学生和务工人员、大街上几乎都没有戴口罩的
1,武汉涌入我们这个皖南小城的已经8000多个人了…害怕
1,你们既然回来了，那就拜托先隔离一段时间吧，谢谢谢谢谢谢谢你们了
1,考验人性的时候啊，那些发烧吃退烧药躲避排查，还往外跑的是什么心态......
1,我们这里已经挨家挨户统计武汉返乡人员名单了！平时武汉到我们这里只要四十多的车费，就在昨天我知道了我爸妈朋友的孩子昨天尽然花了一千让别人把他从武汉送回来了
1,求求你们别来海南这个小岛了，小岛热度不够，全是自驾游来避难的，03年海南没有非典，虽然说这个病毒高温可以杀死，但是现在小岛的温度低阿，求求你们待家里吧！！！
1,近期全国各地的伙计们，不管是不是去过疫区，请死宅在家，莫要乱窜了，好吗？
1,请问像那种人很多，比如94个人在武汉待了4、5天没有戴口罩这种也是只家居隔离就可吗？已经被网友报道说有人没有自觉隔离，到处出去逛的，我们很慌
1,唉一个武汉读研究生的妹儿，前两天回来还到处跑，还到过我们办公室几趟，今天放假的时候领导还特意点出我们办公室注意。虽然她来的时候我刚好不在，但也有点怕怕的
1,球球各位刚从武汉回来的朋友了
1,别整虚的了，给我也整个联欢会行吗
1,请问湖北今天的数据呢？
1,艺考生真的害怕并不是所有学校都延迟校考了请关注吧
1,看微博的基本是年轻人，能不能让几大电信运营商也配合发最新消息给用户。
1,昨天晚上聚会，有个从武汉回来的同学竟然也来参加聚会了，然后今天那个武汉回来的同学就发烧咳嗽，去医院抽血照片，医生又说没什么事，我怕我这个小县城的医生技术不行查不出来，我现在很慌
1,我家邻居还有个前几天从武汉回来的现在到处溜达呢
1,再恳求的问一遍，近期的期限是多久？我是1.7号从武汉飞的海南，现在已经18天无不良反应。不要说我们乱跑啥的，疫情除了最近一周，之前真的没人把它当回事儿。
1,我真的不是想偷懒在家玩我只是不想死为什么湖北黄冈还要1.30开学？已经那么多病例了啊？我知道高三紧张时间少但是我连命都不要了吗？`高中那么多学生聚一起万一出了差错学校担得起责任吗？?球球了推迟开学，多给作业或上网课或压缩我之后的月假都行，我真的不想得病不想死
1,还有那些显摆自己连夜出逃到别的城市的，如果还有点脑子的话，请去医院自首检查吧。别再害人了！
1,你觉得会有自觉的人吗？只能采取强制措施了他们才能去。那些老头老太太和40岁以上的的人都没有意识到严重性呢。
1,真的据说我朋友那镇上有一百来人从武汉回来的，还有一人发烧，这些从武汉来的，请你们为大家想想好吗？
1,尤其是连夜逃出来的人！！对自己负责也是对大家负责！！！
1,安徽zf他么的不能跟河南学学吗？确诊人数这么多都不够引起重视吗
1,你倒是在新闻联播上说啊，你以为中老年人刷微博？
1,我九号从武汉放假回家现在14天潜伏期身体状况很好不发热啥的
1,19号从武汉回已经五天没有出门后面也不会出门希望这场劫难早日结束希望所有的医护人员和病人都能平安归来加油❤️
1,为了您和他人，请自我隔离！感激不尽！
1,真的辛苦可以自觉一点，虽然个年没过好，但是最起码还有命可以平平安安的过很多个年
1,为什么河南旅游局不作为！！！全家8口人，两个发热，其他均出现上呼吸道疾病，却说并不够严重，不能退订旅行社，如果要退订，全额承担费用！这就是旅游局的责任心吗？
1,支持！为了大家，也为了自己；谅解，不要对每个武汉来的都带有色眼镜看待。
1,请逃出去的30万人自觉点先去做检查！别害人！真是没皮没脸了！
1,在家憋4天了，剧荒的要命啊
1,对对对
1,特殊时期，为自己也为他人
1,广西过了一晚感染人数成倍上增！服务区全是成群结队的多外地车，我恨
1,为了他人为了自己，求求了
1,我不想去吃酒席
1,加油
1,强烈请求出逃的武汉人一旦发病，请以恶意出逃罪判刑！并处于大额罚款用于当地医疗补偿！
1,为什么要从武汉出来呢？
1,理解万岁，委屈一个年，对所有人都好，加油
1,他们不会听的昨天我同学在市里开车看到前面一辆武汉的车牌号吓都吓死了都已经封城了为什么还要跑出来
