1,强烈建议加强农村偏远地区的宣传，从全国各地返乡的，都很有可能携带病毒，这两天将会是春运的最高峰，农村的人这方面意识比较薄弱，很有可能不知道病毒的可怕，所以请乡村干部们加强病毒的防治措施，加大病毒可怕的宣传力度！
1,我觉得全国都不能开学啊！
1,请给铁路工作者们配备口罩和防护服吧！！！！（普速列车、高铁、动车）他们接触大量旅客很容易被感染同时也因为接触大量旅客所以绝对不能被感染！！请允许他们戴口罩吧，不要因为仪容仪表我们旅客不在乎正值春运火车属于密闭空间！车上全国各地的人都有
1,疫情严重肯定会延期开学的
1,中小学可以临时通知，主要是大学生啊，来自五湖四海，而且还要提前订票啥的，不提前通知真的没办法安排行程。
1,大学生呢？？
1,大学应该也这样  武汉大学生最多了
1,大学.....北京的表示有点慌
1,能不能延迟上班
1,延迟开学暑假再补也可以，武汉大学生那么多，真的受不起…
1,真的推迟开学吧减少人员流动！！！！！！！
1,全国各地都有，不要认为自己的所在城市没有报道出来就是安全，潜在的病号数不胜数，我们要做的是保护好自己。
1,上班族请求统一（举手）
1,不是，高校不就是大学吗？大家在问什么呢
1,能停课还是最好全国都停课吧，这样真的让大家都没有心情上课，上课也不会专心的。而且学校真的是传染病的多发地，还是有风险的。为避免像sars那样，还是停课吧
1,大学生最应该推迟不管是去武汉上学的还是武汉人去外上学
1,小中大也一样吧
1,懵逼了请问三月有可能要去武汉参加研究生复试的怎么办
1,那其他省份的大学
1,高三学校要求初四回去坐标武汉武汉睿升学校
1,建议全国学校延迟开学，尤其是大学，流动起来人口太大了。
1,大学生出去上学才危险吧！
1,求求您了，来不及了，澳门2.3开学，我有武汉同学[骷髏]
1,还有武汉高三学生！！！大年初五就要回学校了！！！怎么可能安心上课
1,建议全国大学中学小学全部推迟开学！
1,武汉百万大学生，希望能尽快作出措施，疫情得到缓解！
1,建议推迟，特别是大学生。
1,别说什么“你们就是不想开学”这种话，我们只想爱惜生命，不让肺炎一直传下去，恢复过后暑假不放都可以啊！人都没了学啥有什么意思
1,还有我们高三补课生....2.1就回去了
1,全国的高校应该都要考虑推迟吧全国高校都有武汉的学生啊.....
1,大学生！大学生！各地的大学生……
1,郑州飞墨尔本的航班，中转在海口，然而武汉飞墨尔本的航班，中转也在海口，郑州和武汉两地后续飞墨尔本的是同一班飞机，可是为什么从武汉出发的可以免费退改，然而从郑州始发的就不能免费退改呢，虽然两个出发地不同，但是后续航班是一样的呀？求转发求看到
1,艺考生呢？？？人哥？？？？？这马上就快了
1,现在还在犹豫买不买去武汉的票和从武汉出发的回学校的票！
1,怕的是，武汉的学生不仅仅在武汉上学啊，遍布全国各地希望开学前能有效控制疫情
1,保护学生安全，听从政府安排
1,研究生研究生！！！！看看我们弱小的研究生吧，初十就要上班
1,大学生不是学生吗？呜呜呜，哭了，我们上了年纪，相比中小学生更易感染啊喂
1,大学生？
1,有些高三放一个星期就回校了
1,全国的大学生啊武汉的孩子也要到全国各地上大学啊
1,我担心的其实是年后的艺考校考，那乌央乌央一大片人的挤在一块考试那咋办啊
1,更麻烦的是艺术生校考啊
1,还是都推迟吧，到时人流量一大可能渐渐消退的有起来了
1,机场停留就
1,停留2小时就？？？
1,在武汉机场停留两个小时？？？
1,仅在机场停留？？？这太可怕了
1,在机场停留就？？？？
1,大连这个39度上飞机，还TM坐地铁，坐公交去大连中心医院。就是个坑B
1,这个更新看多了，总觉得自己身体哪里不对
1,平安
1,这。。。停留两小时就被感染了武汉还能待吗
1,仙桃工作在武汉停留，要么就是停留期间与在武汉的感染者有接触，要么就是仙桃也有感染者，可能未就医等原因未发现。总之这个事情来看，病毒的传染性可能正在提升。
1,坐飞机的一群人，然后这个飞机还会飞向别的地方，诶。
1,全国各地都有，不要认为自己的所在城市没有报道出来就是安全，潜在的病号数不胜数，我们要做的是保护好自己。
1,肺炎都给我滚开！！！
1,真的，我真的超害怕。
1,你小心……经停两小时……
1,就在机场停留两小时就感染了？？太可怕了
1,怎么全都是输入性病例！
1,停留2个小时，我的天
1,就停留了俩小时?
1,发烧了还往外跑？
1,曾在机场停留……就
1,在武汉机场停留都感染了大家真的要千万千万注意啊
1,机场停留两小时就……
1,一刷新怎么又有了？！？
1,停留就感染了
1,我们村的喇叭天天喊的都是禁止燃放烟花爆竹  违者一万以上五万以下  我特么真服了  鞭炮再厉害能传染疾病吗  波点有用的不行吗
1,唉沈阳也有了能不出门就不出门吧出门一定要戴口罩啊！
1,晕能不能先封锁武汉站啊
1,我开学都不敢回去了我靠
1,心惊肉跳的数字变化，都知道病毒这么汹涌厉害，都原地卧倒！老老实实呆着有那么难吗？不到万不得已都别动，还有比命重要的吗？
1,仙桃到桃仙……
1,太快了我的天
1,武汉不封城请把辽宁封上吧
1,注意安全，戴口罩出门，武汉加油吧，尽量避免走动，为了家人着想，尽量待在武汉，医护人员辛苦了，请给环卫工人免费配口罩吧，他们不论什么时候，都在为我们服务
1,绕开武汉呀
1,我滴妈呀，就只是在机场停留两小时就着上了！各位注意安全！
1,这家伙就在机场停留了两小时就中招了！连呼吸都是错的……
1,快好起来吧
1,东北也“沦陷”了
1,“停留”这个词希望小编再确认下，如果本来就在当地工作或出差也说明下，不然容易造成恐慌…
1,封城吧！三四线很多大妈大爷都还不知道的，还正在风风火火办年货菜市场买鸡鸭鹅呢！我妈他们都无所谓，新闻也没啥报道！！！
1,真的不要乱跑了！！！呆在武汉吧
1,我刚看热搜说年轻人和儿童不易感…那有没有一个准确的定位，多大算年轻人啊（我觉得33岁也蛮年轻的啊……这不也是感染上了
1,一定要平平安安的
1,希望都平平安安
1,这证明武汉的工作做的太不好了，机场停留都能感染。
1,大家有症狀時應該就醫
1,一切安好
1,在武汉停了俩小时就被感染了？？？？？我靠无情
1,在机场停留就感染了，我天，我是真的快神经了，在家开窗怕病毒混进来，不开窗怕屋里空气质量不好。刚才做了个煎馒头片，感觉没熟，都扔了，我现在只吃生菜沾酱，买酱都得看看生产场地，神经了，神经了
1,平平安安啊啊啊我好害怕
1,大连
1,福建到底怎么个情况啊。。pyq乱传到起飞
1,只是在机场停留就感染了吗
1,在机场停留就染上了吗？
1,两小时就传染了？？？！！
1,别乱跑了。。。。。。。。。
1,？？愿大家平平安安
1,加油武汉
1,武汉机场停留？
1,我的天呢，停留两小时就被传染了
1,卧槽，武汉现在是病毒场了吗？？？机场呆一会就传染上了？太可怕了吧
1,11日发热17日去大连
1,所以我们仙桃到底有没有害怕
1,让我这个过几天要去大连的人怎么办
1,有一武汉老太太，丈夫发热送医院隔离治疗第二天她就从武汉动车直奔江苏，中途就发烧，下车就被隔离治疗了，请问武汉政府到底有没有在管控？这种密切接触者都能上动车？
1,希望加强监控力度
1,机场停留?两小时?武汉加油!陕西你给我稳住!
1,就tm离谱
1,停留就能患病
1,求你们了别跑了
1,别人我不敢说，就我认识的武汉人，包括我自己，我父母，我的亲朋好友，这个春节会全部呆在家里，不会外出，也不会去外地。请放心。然后祝大家平安。
1,海南都……今非昔比了，现在不比非典那时候交通不发达了，要怎么劝才能让我爸妈重视起来他们就觉得非典的时候啥也没事到现在也是啥也没事……
1,希望接下来都是好消息
1,靠。。海南也。。
1,几号进入的你他妈倒是说清楚啊？！！！跟他一车厢的人不追踪还等着过年吗？！！反应太慢了！！要快！！时间就是生命！！
1,真的到昨天我还看到很多人从武汉来海南的一直说着海南是避风港避风港拜托在疫区呆过的人能不能放过小岛阿本海南人真的怕死
1,能不能让武汉的别乱跑了，非要把病毒散播到全国吗？！
1,感染者们求你们不要再动了
1,求你们了别跑了
1,为了大家的安全，把武汉封了吧（没有歧视武汉的意思）
1,海南。。。求求你们待在武汉别跑了吧
1,求武汉封城
1,本海南人慌的一匹
1,阿冠真他妈调皮  乱窜
1,那些说地图炮的都是什么心态？还有一直说会有逆反心理的人都是人？难道（有可能携带病毒存在潜伏期）的人让他不乱跑有错吗？难道满世界撒欢全部传染才开心吗？
1,希望以后出院的消息多些，感染的人数少些
1,是一家人吗？我1516号在广西接待武汉一家四口经过广西去海南的
1,卧槽我就是海南的
1,中国加油！！禁止
1,我连出门买口罩的勇气都没有了
1,免费送8️⃣0️⃣0️⃣个
1,强烈要求封城，下午一个武汉女的都从武汉做车逃到扬州了，她自己发高烧，老公已经确诊了，害人害己
1,大家都注意安全啊！
1,春节暂定去三亚旅行的慌的一批！！给旅行社也下个退费政策吧！！
1,不要再乱跑了好吗
1,我哥哥昨晚说他在武汉的战友说不碍事的没那么严重，现在看来，这个战友可能对实事不是很了解。
1,目前海南省共确认4例病例，均为输入性病例，4例患者病情平稳，体温已恢复正常，正在定点医院隔离治疗。
1,能不出去就别出去了，啥要紧事啊？还有心情旅游，我真服了
1,求你们别跑了！别来海南！让海南人民过个好年好吗
1,海南非典的是顶住了。肺炎结果沦陷了。，能不能别乱走了武汉的哥们？
1,在海南哪里隔离？琼海市没有吧
1,他们到底在武汉共同接触过什么，怎么去过回来就会有？到底还有什么传播途径？
1,三亚那个如果我没记错的话，好像是明知道自己发烧了还飞往三亚的吧?
1,我真的想说，武汉市民是无辜的，但暂时的牺牲也是必要的。我认为以制度鼓励自觉最好，所以建议疫情过后，武汉市政府应以政府财政补贴方式，对无外出武汉市民给予补偿，追加补假5天，若放弃补假则给予全市平均工资5天的经济补偿，以奖励武汉市民顾全大局春节大假不外出的义举。
1,这几天输入性病例肯定还会有，毕竟有潜伏期，但是不幸中的万幸是他们病情好转，也很有可能没有继续传染当地人，也恳请现在武汉的兄弟姐妹们暂时哪里都别去的，你是健康的，但是别人不会这么认为，将心比心，也能理解，也请外地朋友不要无脑地域攻击，做无知添乱者的帮凶
1,挺住！
1,海南老人孩子那么多，7w武汉人涌入，里面有多少携带者？能不能放过小岛，小岛的医疗环境还没其余人多的北上广深好，现在还跑过来做什么？？？
1,武汉人来了海南共7万多人，目前却只公布确诊，没有公布疑似？担心引起恐慌？不透明不公开才会引起恐慌！！！希望海南政府放弃侥幸心理！！！严正以待！！！高度重视！！！
1,这么小地方就确诊4例，故意过来避难的吧。我日，真是憨批。
1,海南除了环境什么都落后，不管是医疗教育还是办事人员，偏要跑过来，这是做什么？很多都是上年纪的中老年人来过冬，都是易感人群，是要搞海南么？
1,其他省坚持住，我们与你们同在
1,我觉得海南别让人进岛了
1,太可怕了
1,琼州海峡防线已破…………（当年非典海南可是一例都没有
1,钟院士提倡封城是对的，为何让源头四处走动呢？现在是全国恐慌，春节后会越来越多
1,武汉朋友们，关键时期能不能别来海南了，也别跑去其他地方了，别搞的全国各地都有，人心惶惶啊
1,有个都低烧了还硬要过来，海南的医院好住是吗？
1,明天回海南的我，瑟瑟发抖
1,还什么本地人外地人，病毒就是武汉输出的啊。本人湖北的现在也希望武汉甚至省内的都不要乱跑，一起渡过难关，别来地域黑也别来分什么本地外地了好嘛。武汉加油，湖北加油，中国加油
1,我刷了一天    海南冠状病毒   ，一点都不想刷出这一条
1,海南的我震惊了……
1,希望在汉的同胞们这次不要再返乡了，为了一家人，害了一城人。
1,一刷新就有新的天呐一定要平安
1,建议停了武汉飞三亚的航班
1,呼吁一下吧，让外面的人别往海南去旅游了。
1,靠海南人民开始慌了
1,真心不是地域歧视，求武汉人民别往外跑啦！要祸祸多少人啊？！
1,天哪海南也有了
1,一个午觉睡醒，从疑似一例变确诊4例，然而还是劝不动爸妈戴口罩！我爸哪那么严重，我妈去市场戴什么口罩，整条街没人戴。我求求了，相关政府想想办法宣导一下吧，小地方才危险啊，大家意识都不强，而且年关到了，哪里都是人群扎堆，置办年货
1,之前武汉的人说内部不重视没人戴口罩，还嘲笑我们别的省的人小题大做！！！非要整个中国陪葬么
1,飞猪订春节去海南度蜜月，结果看到疫情严重，身边人又咳嗽，计划取消，机票都退了，结果三亚万达希尔顿逸林酒店就是不退，将近四千的房费，卖家还说海南很安全，说要退必须有发热证明和航班取消证明才可以，对于我们普通人，这四千真的舍不得白白扔掉，我们接受扣手续费退房，酒店不行，真是让我们哎
1,弟弟大学放假从武汉回来后咳嗽今早发烧，家里人多少都有点咳嗽，中午父母陪去检查至今没有回家，刚接到一通电话得知家人被隔离还未确诊，经过一番询问，我现在紧张的咳嗽严重了，怎么办
1,目前发现的各地的病例都是来自武汉的无一例外求求武汉的人不要乱跑了
1,怕了怕了慌死了…
1,海南的医疗水平不能跟内地比，求封岛吧！
1,真的服了，他妈的能不能不要瞎几把乱跑，心里能不能有点数了，造成其他地区恐慌很开心嘛？能不能考虑一下别人啊，今天刷新闻这城市确诊那城市确诊的，海南就那么大点，好的医院也就这么几家，医疗技术啥的没内地发达，寻思啥呢啊
1,我也是武汉的我哪也不会去十五天不出门都可以！但是我的朋友们认识的武汉人到处跑天天喊撤离…
1,请求武汉封城，不是歧视，真的是为了防止在蔓延了，从源头上切断传染
1,真的不要说我们恶毒麻烦在武汉呆过的或者啥的你们在武汉治不好吗集中起来非要满世界跑跑跑传到满世界才开心吗我真的服了那些非常时刻还出来探亲旅游的你是这辈子只有这个时候可以出来探亲旅游吗？就不能团结起来把这个治好吗每次一看到哪里哪里出现首个患者就全是从武汉来的
1,应该推迟开学吧
1,高三的还在补课啊！
1,没想到今年的年货是口罩。​​​
1,阿冠听我的  谁吃的野味你去找谁让大家好好过年吧
1,武汉那么多大学真的推迟开学吧减少人员流动！！！！！！！
1,推迟开学吧
1,就算不活动，学校上课，食堂，浴室宿舍都是无法避免的人口密集
1,可以不开学了吗
1,上课算聚集性活动吗
1,那就推迟开学吧
1,SARS过后，广东不仅扑杀了全部果子狸，并且禁止了野生动物交易。  事实上，人类进化到今天，8000年历史，老祖宗把最好吃的、最能吃的都给我们了，对于摄取蛋白质都足够了。野生动物提供不了什么特别的东西。
1,保护好各位医护工作者，尤其要保护好钟南山院士啊！80多岁的人了，为此尽心竭力，到处奔波，还奋战在武汉第一线，他不仅是首席专家，还是中国抗病毒的旗帜，是精神支柱，防护工作一定要加强啊。
1,年后的研究生复试怎么办？？？
1,开学时间延期吧，孩子是祖国的未来
1,我一个舍友武汉，一个舍友日照，一个舍友青岛.....
1,我们2月1就要开学....
1,学校人群密集可不可以延迟开学
1,延迟开学没必要狗头保命很正经的事
1,推迟开学吧！暑假延迟可以的
1,真的，推迟开学吧，一个班那么多人，到时候大家都带着口罩上课吗？那吃饭呢？吃饭的时候饭堂那么多人，这怎么防啊
1,大学要不缓缓……？全国同学一起住宿过集体生活还是挺麻烦的
1,开学算不算聚集性活动
1,到时开学的时候我们湖北人还让回学校么
1,2.8开学合理吗
1,推迟吧真的
1,延迟开学吧学校有各地来的人谁也不知道谁什么情况（不是歧视也不是杠就事论事）
1,我们学校（大学）组织活动要求初八返校那是否可以要求学校延期活动呢
1,三月份招聘考试，该出的简章迟迟不出，不过我这个好像属于卫生局管，但是我迫不及待参与到斗争中去啦
1,防患于未然利己利人
1,高三2.9开学
1,我现在都还在学校
1,高三初七开学
1,我是真的不敢回湖北上学了
1,现在希望我大中华平安喜乐
1,我们学校在岳阳，离武汉好近，正常开学
1,会推迟开学吗
1,大家都要小心。打起十二分精神防范
1,快开学了……
1,中国加油
1,那武汉上班的怎么搞啊？
1,建议推迟开学
1,延迟开学！武汉那边很多大学二月初就开学了啊，一百二万人呐
1,我的天！深圳也越来越多了
1,我是不太想上学
1,这种广泛性传染病重灾害，政府不应该调集有效防护供给人民吗。反而现在老百姓要花高价来购买市场急缺的防护口罩。悲哀啊。
1,那啥，高中开学考建议学校取消一下，人多，流动性大，不戴口罩考试咳嗽不捂的人很多，建议取消一下
1,严重或者有病例的地方应该延迟开学吧一个学生中标他那一个班也都会被传染吧  学校真的传染速度太快了
1,推迟开学吧...真的很严重，不说外地人不敢去武汉上学，武汉学生也不敢去火车站等车啊
1,那么多人住一栋楼还要正常上课吗？能不能再观察一下情况再考虑是否延迟开学啊
1,支持
1,年后的艺考怎么办呢
1,艺术生非常的卑微3031号要奔往考场等待考试！！！
1,美术生要校考了
1,延迟开学！延迟开学！延迟开学！
1,是会推迟开学吗
1,年过完了可能真得推迟
1,都要平安都要好好的
1,推迟开学吧！！
1,会有延迟开学之类的措施吗
1,大学的社会实践可以取消了吗？
1,求推迟开学吧，我舍友开学前几天依然坚持去重庆旅游，旅游结束当天就开学，怎么劝都不听，我要吓死了
1,推迟开学吧
1,会推迟开学吗？
1,延迟开学吗
1,孩子们寒假终于不用补课了！
1,武汉地区推迟开学吧
1,或许应该延迟开学
1,那就延迟开学
1,高三的还没放假呢！
1,想想还要年后全国艺考我就脑壳疼
1,发国难财的都biss
1,没想到今年的年货是口罩
1,但凡那么几个憨批管住自己的b嘴不吃野味也不至于全国乃至全世界为他们善后
1,一个N95   100多
1,没用黑龙江这偏远小县城昨晚买普通口罩9.8/袋  今天买就涨到19.8/袋，给12315举报人家说现在都是市场经济了，我们也没法管，买的多了自然就会涨，供不应求了嘛政府全有理，吃亏的还是我们消费者，管控？呵呵（请送我上去谢谢
1,淘宝搜了半圈几乎没找到什么正经经营卖医用外科口罩的卖家，销售者要么刻意模糊产品性能涉嫌销售欺诈，要么涨价几倍甚至近十倍恶意哄抬物价。可能由于有关部门在查这个事，大部分销售者纷纷下架店铺相关商品。希望监管部门也多多关注一下网络销售平台！！！
1,拜托电视上多多宣传吧还有短信老人们真的不知道
1,别发国难财
1,别罚太重，毕竟人家只是想赚点钱过年，就罚这些人戴着自已的口罩去隔离病房打扫一下卫生吧！
1,为什么元旦前发现的时候不及时的采取措施，专家说的可控可信吗，他们都没有结论的，那也是造谣吧？为了不让市民恐慌就不积极防范，就今天这个局面市长也说了，预警不足……拿生命开玩笑呢，前天我刚从武汉回来，现在我只能在房间里面都不敢出去，吃饭也是叫我爸妈送给我吃，这个潜伏期那么长
1,还记得h7n9吗！！病毒最后会被打败的！！加油！！医护人员辛苦了！大家出门一点要带好口罩，要勤洗手！
1,发国难财必遭天打雷劈
1,别北京了，淘宝就要治一治了
1,淘宝上一包口罩950块，这种钱，赚了昧良心
1,发国难财的遭天谴哈
1,淘宝上口罩的价格了解一下
1,灾难已经上升到国家层面，也可以说国难当头，那些趁机哄抬物价的不良商家，你们良心在哪？
1,我们这里卖口罩的，昨天十块钱三个，今天四十五三个，接着打了12345反映，政府部门下午就去查了，效率不错。
1,发灾难财的真的没有心
1,昨天在网上取药订了口罩，结果外卖小哥到了打电话说药店很多货但是店员不给他，然后店家打电话非说没货让我取消。北京现在根本买不到适用的口罩。
1,这件事干的好！干的漂亮
1,我其实是很担心年后的，特别是那些家在武汉的朋友回家过年节后又回来的，这样又串一波
1,重灾区江汉区，我家对面同济堂大药房的一次性口罩卖10块一个了，两个婆婆望而却步的离开，默默的说一声不带没有事情的。谁不爱惜生命？
1,发国难财没良心
1,建议政府调一些库存免费给武汉同胞发放n95口罩
1,新纶科技给武汉红十字会捐了六万只口罩，良心企业，比那些坐地起价的商家好多了。
1,能不能公布下各款口罩的价格空间，这样买的时候也好判断是不是涨价了
1,太正确了，这帮发国难财的东西，必须严惩不贷，弄的我们连个口罩都买不上！
1,自己家药店，在跟我爸商量免费发放一下口罩。
1,坐标杭州，小区附近的口腔医院免费发放口罩，每人两个，很暖心。周围药店都断货了。
1,投诉电话是12315还是上面说的12345？不是打12315吗？
1,我到我到现在也没有买到口罩。。。。药店没有。。。网上买的至今没有发货。。。。请问我该怎么办
1,坐地起价者小心阿冠找上门
1,唉我在杭州买的普通的医用口罩一袋10个要20块！武汉溢价情况肯定更严重了
1,我刚搜了淘宝有个叫创善医疗的，好像卖的外科口罩还很便宜啊，一包50个才十几快，100的48好像。没买到的都去看看他们是不是真的吧！
1,播打12315热线，响铃两分钟都没有接听。我想举报的是湖北襄阳长征路上天济大药房售卖普通独立包装竹炭口罩，一只的价格定价9.8元，远超市场普通价位。
1,发gnc的人会被阿冠看上的哦
1,希望大家明白我们是一个大家庭
1,不是贵的问题是买不到了
1,赶紧罚好吗？？？在武汉，昨天晚上出去补口罩，基本每个药店都是翻倍的涨，还有的药店直接把普通口罩一盒卖到一百多！！重点是他们还一直误导消费者推荐更贵的防雾霾口罩，还有个药店工作人员一人分一箱，给我们限购一人两盒，一盒才五个口罩真的是危险出现就看到人间满满的恶臭
1,12315叫电话都打不通，谈何处罚？
1,我医用外科35一个
1,3M口罩原价大概5块钱一个，现在涨到二三十一个？我没有针对任何卖口罩的人，可能大家拿货也会贵了一点。商机并不是现在道德的边缘趁国难之际趁火打劫、哄抬物价。无德无良，何为商？这些话仅为我的个人观点，不知是不是我三观过正情商过低，还是我没有商业头脑不懂变通。
1,能不能政府部门售卖或者免费发放啊，你这在这儿喊严打根本打不到几个的，效果点又不理想，还是买不到口罩
1,过年当头，发国难财，这些人的心都是黑的
1,发国难财必遭天打雷劈
1,愿平安
1,什么时候可以来管管西安的药品价格?买的药品远高于平时的价格，打电话到消费者协会投诉，人家给我解释的是，非处方药是市场调控价格，没有严格界限，那这意思是，想卖多少钱卖多少钱咯
1,我们山东已经涨钱了，比之前价格翻了三倍。口罩
1,淘宝里一个口罩运费500的可以管吗
