1,南宁至昆明方向没经过武汉啊！所以，那名发热的病人，有过武汉史，还是有密切接触史？还是说，完全没有相关史？
1,山西山西！
1,还跑还跑你跑你
1,其实酒店更危险的，要登记，没做好也是传染源。很多武汉出来的，你说能住哪里啊，住酒店要通报。。酒店消毒不到位，下一个客人就遭殃。
1,求求了  好好待在家里吧  真的不能再多了  半个中国都有例子了
1,………………………………？
1,金融民工跪求股市延期开市
1,   云南虽然启动了一级相应有人说亲戚都在加班那么是下面的人没有做事吗❓云南省曲靖市我在的某个县里还没有任何通知❗没有任何防护措施❗云南省是旅游大省但是很落后现在不重视到时候医疗条件跟得上吗❓云南政府不是发个通告就完事了，请务必落实！云南穷乡僻壤真的没人关心
1,在广东的我，瑟瑟发抖！年后一大波人回来上班
1,扩散！
1,注意安全！！！
1,我那天做的D3938，今天看到这个新闻的时候吓到了
1,文山人民瑟瑟发抖外加说不听的长辈明天还要家庭聚会
1,云南省在这个时候还在要求贫困户全部集中到新农村过年，一个都不能少，每天有人清点人数，新农村都是一户紧挨一户，人口密集，后果不堪设想，不知道这些人是蠢还是坏！为了迎接上级检查这样真的好吗？
1,放心吧，一定会好的
1,其实还有很多事情，如果疫情能在开学之前控制住，可开学之后大家又重新挤在一起，食堂上课等等，万一有人是患者，或者说是没发现的患者，人传人。。。。。。
1,我觉得趁着过年一下子放假放到正月十五好了，对防控疫情有好处，有些经济牺牲是必要的
1,我是云南文山州广南本地人，村里面没有任何宣传，大家都还在串门走亲戚，聚会，镇上没有几个人戴口罩，清帮帮我们吧！！！请政府管理宣传一下吧。
1,实名核查！通知到个人！实名核查！通知到个人！实名核查！通知到个人！实名核查！通知到个人！实名核查！通知到个人！实名核查！通知到个人！实名核查！通知到个人！实名核查！通知到个人！实名核查！通知到个人！实名核查！通知到个人！实名核查！通知到个人！实名核查！通知到个人！
1,有的人长个眼睛出气的吗？这条微博上再有骂武汉本地人的，我见一个骂到全家自闭为耻
1,车票是实名制，当地民警也有在排查，发出来一个是让当地人要注意防护，还有就是提醒周围的人，且警察找人也不是马上就能找到，各种渠道和方法都用上更好，所以，不要纠结实名制这个问题了，拜托多关注关注新闻本身，多想想吧。
1,可以减少其他节假日的假期时间，请延长春节假期！！！返工返校大潮真的太不可控了
1,文山当地人在家好好呆着！不要出门！出门带口罩
1,自己能不能自觉点，每天看到这样，一条臭鱼，气死了
1,陕西那个24岁女孩子也是坐高铁回来的。。。
1,所以他现在在大理？……？……我害怕我害怕我害怕
1,别跑了求求你们还要来祸害我们文山吗
1,害，这这是我看见找人的第三趟列车了。隔壁车厢也要注意，万一他刚出厕所。你又进去了，是不是也有风险
1,别太自私了，自己有病就好好待着，跑什么，千里送病毒？
1,莫挨劳资大云南
1,我爸前两天还想带我去文山爬文笔塔呢。还好前两天高中老师各种打电话了解回家大学生情况，他立马就知道不能去了。
1,我不认识您但谢谢您一路走好
1,这就是医生，离开了他热爱的工作岗位上。
1,终于到了啥也不干在家躺着就能给社会做贡献的时候了（大家都好好呆着、不要乱跑添乱（既心酸又无奈
1,哎真的是被那几个吃野味的气死！！！！
1,走好！
1,吃野味的，卖野味的，你们让多少无辜的人为你们擦屁股，为你们赔命！强烈要求立法！贩卖野味判处死刑！！！
1,致敬
1,告诉家里人不要往外乱跑走亲戚，真的很重要，别为医疗资源增加负担我们要过年，医护人员也要过年，能尽量减少他们的负担就一定要减少！
1,一路走好
1,我不认识您，但是我此刻无比尊敬您！一路走好
1,医生他们太累了
1,他们也是爸爸，妈妈，孩子，弟弟，姐姐  他们有的很累了，有的还在饿着肚子，有的已经几天没有回家了。  可是他们仍然在冒着生命危险去救一个个陌生人。
1,肺炎谁引起的，曝光一下。全国人民为你插屁股。
1,最怕这样的事情发生，请保护好自己
1,致敬！走好
1,太难过了
1,想哭想说谢谢
1,……
1,所以是今天一天两个医生因为这个病毒离开了吗
1,感谢有你，一路走好
1,最美的白衣天使！一路走好！
1,虽然不认识您，但很感谢您，姜医生，一路走好
1,好难过啊
1,大年初一在这里祝吃野味的原地爆炸，大过年的让全国人民都过不好年，真应该立法，像这种情况，就应该判那些吃野味的终身监禁，不得减刑
1,痛心姜医生一路走好
1,心痛
1,08年鼠年，我们为四川加油。现在20年鼠年，我们为武汉加油。希望下一个属年我们都不需要这个“加油”。
1,警醒一下啊，能不能调整医生工作时间，就算再忙也要有足够休息的时间啊，一直让人连轴转谁受得了！
1,一路走好
1,其他医生都给我平平安安的[
1,我太难受了！！！！他们太伟大了
1,虽然，我不认识您，但是谢谢您，一路走好，辛苦了，感恩
1,一路走好向你致敬
1,虽然，我不认识您，但是谢谢您，一路走好，辛苦了，感恩
1,昨晚武汉的护士和医生过年都没有饭吃，不能和家人团聚，抱着不回去的心去前线救人，你们就是让这样的英雄吃泡面？艹泥马
1,一路走好
1,泪目了感谢您的付出走好
1,走好
1,致敬
1,逝者安息
1,致敬
1,辛苦了
1,感谢您的付出走好
1,走好
1,走好愿天堂无病痛愿善待善良
1,谢谢您，一路走好！
1,一路走好
1,走好
1,致敬！
1,愿天堂没有病毒~
1,一路走好
1,疫情通报能不能详细一点
1,  乡镇村民的防范意识几乎没有，真的很担心，请政府务必重视，落到实处❗❗❗（请广大网友点进话题看一看扩一扩
1,？？？
1,谢谢您对医学的无私奉献，一路走好
1,眼眶一酸，希望大家都能平平安安顺顺利利的，在救治别人的同时也不要忘了保护好自己
1,来人间这一趟，辛苦你了走好
1,走好
1,辛苦了❤
1,逝者安息
1,谢谢您，一路走好！！！其他医生，一定要平平安安的呀
1,会好好对待他的家属的对吧
1,对医护人员好点吧不想再看到这种新闻了
1,rip
1,谢谢白衣天使
1,逝者安息
1,吉林快啊！！
1,辛苦了，
1,！！！
1,吉林！！
1,吉林跟上！三省共进退！！！吉林跟上！三省共进退！！！吉林跟上！三省共进退！！！吉林跟上！三省共进退！！！吉林跟上！三省共进退！！！吉林跟上！三省共进退！！！
1,吉林
1,啊啊啊啊啊辽宁终于动了啊啊啊啊啊啊啊啊啊啊啊
1,山西急一急山西急一急山西急一急山西急一急山西急一急山西急一急山西急一急山西急一急山西急一急山西急一急山西急一急山西急一急山西急一急山西急一急山西急一急山西急一急山西急一急山西急一急山西急一急山西急一急山西急一急山西急一急山西急一急山西急一急山西急一急山西急一急山西急一急拜托了
1,东北就差吉林了
1,终于等到你陕西山西吉林睡醒了没？
1,请陕西发布一级响应❗️请陕西发布一级响应❗️请陕西发布一级响应❗️请陕西发布一级响应❗️
1,内蒙！！！！快点啊！！！
1,辽宁zf舍得从炕头上下来了
1,辽宁！沈阳加油
1,吉林呢
1,内蒙古醒一醒？
1,吉林？在？联网好吗？
1,陕西呢，还没醒吗？不止西安啊
1,请吉林发布响应❗️请吉林发布一级响应❗️请吉林发布一级响应❗️请吉林发布一级响应❗️
1,吉林省你在干嘛呢醒醒啊
1,其实我想知道启动完会有什么实际不同（纯提问）
1,内蒙古醒醒吧，赶紧连网上线啊
1,短信发起来  家里的老人真的不看新闻都不知道辽宁有肺炎啊啊啊急死说了又不听求求宣传力度大一些吧
1,吉林领到昨晚上喝多了，等醒酒呢
1,山西人民真的卑微
1,吉林快点吧
1,吉林跟上啊！大东北就差你了！
1,吉林等什么呢！！！！！！
1,吉林求求了吧就差吉林省了
1,如果你是db人，别老说什么抄河南作业了，河南好几十例也才刚刚启动一级，咱们辽宁和黑龙江算很早的了，相信咱们当地z'f比你更懂
1,吉林急一急吧❗求求了
1,加油辽宁一切都会过去
1,陕西山西吉林帮催！！
1,吉林啊吉林急死我了急死我了急死我了急死我了，求求了赶紧启动吧，身边太多一点危机感都没有的人了，真的可怕
1,辽宁醒了！！！
1,请吉林一级响应请吉林一级响应请吉林一级响应请吉林一级响应请吉林一级响应请吉林一级响应请吉林一级响应请吉林一级响应请吉林一级响应请吉林一级响应请吉林一级响应请吉林一级响应请吉林一级响应请吉林一级响应请吉林一级响应请吉林一级响应请吉林一级响应请吉林一级响应请吉林一级响应请吉林一级响应
1,国家批了国家批了国家批了国家批了不是后娘养的！
1,血书不要走亲戚!千万不要!别坐飞机高铁火车，密闭空间别去!!能不拜年就别拜年了!求求，赶紧给死遵风俗礼节把人情当做天的中老年人多加点宣传吧求求了。我真的希望辽宁封城，别进来了
1,辽宁你终于连上网了可赶紧的吧还有人不戴口罩呢赶紧加大通知吧咱也不知道都咋合计的
1,内蒙内蒙内蒙
1,我想问下启动了然后呢…
1,⚠️吉林急一急吉林急一急吉林急一急吉林急一急吉林急一急吉林急一急吉林急一急吉林急一急吉林急一急吉林急一急吉林急一急吉林急一急吉林急一急吉林急一急吉林急一急吉林急一急吉林急一急吉林急一急吉林急一急吉林急一急吉林急一急吉林急一急吉林急一急吉林急一急吉林急一急吉林急一急吉林急一急拜托了
1,东北三省！吉林跟上！
1,大连想要个市长求求了
1,hài看来我们吉林人民真是天不怕地不怕啊
1,吉林你给我醒醒！！！！你干啥呢！！！！两个老大哥都响应了！！就你还做梦呢！！！
1,辽宁加油
1,吉林
1,身在大连，上街走一圈根本没多少人戴口罩，短信一个没发，串门聚餐一切正常，劝父母别去骂我有病瞎说，被迫出门拜年聚餐，现在只能看命硬不硬有屁用。
1,吉林醒一醒吧冬三省就差你了
1,吉林你能不能急一急！！！！！！
1,吉林你想啥呢？快点啊
1,内蒙一级响应!!!
1,我亲爱的大山西！！！咱也该醒醒了！！！！！！！！！！
1,啊啊啊啊啊啊啊啊啊查一查开到辽宁的鄂A.车辆吧！！！！！球球了！！！！！可多了！！！！！！！！！球球看看我
1,终于等到你
1,内蒙古呢
1,吉林你醒酒了吗
1,陕西山西内蒙古吉林看一看？年该过完了
1,黑吉辽，兄弟仨都不能落。辽宁人民呼喊吉林，吉林加油！大连人也呼吁Zf多多提醒，监察来连人士，没有市长，市政府和其他部门也要保护好自己的人民
1,吉林急一急！！吉林急一急！！吉林急一急！！吉林急一急！！吉林急一急！！吉林急一急！！吉林急一急！！吉林急一急！！吉林急一急！！吉林急一急！！吉林急一急！！吉林急一急！！吉林急一急！！吉林急一急！！吉林急一急！！吉林急一急！！球球了！！！！
1,建议今年春节假期延长至正月十五。一举两得
1,吉林求求你跟上
1,辽宁省加油！吉林加油！黑龙江加油！东北三省加油！中国加油！！！
1,山西我就是要当最尴尬的省
1,  乡镇村民的防范意识几乎没有，真的很担心，请政府务必重视，落到实处❗❗❗（请广大网友点进话题看一看扩一扩
1,取缔麻将馆取缔麻将馆取缔麻将馆取缔麻将馆取缔麻将馆取缔麻将馆取缔麻将馆取缔麻将馆取缔麻将馆取缔麻将馆取缔麻将馆取缔麻将馆取缔麻将馆取缔麻将馆取缔麻将馆取缔麻将馆取缔麻将馆取缔麻将馆取缔麻将馆取缔麻将馆取缔麻将馆取缔麻将馆取缔麻将馆取缔麻将馆取缔麻将馆
1,我是吉林松原的，我家楼下是麻将馆，天天人爆满，都不带口罩，抽烟，在楼道里吐痰的，你说我慌不慌？？
1,东北人生吃葱蒜蔬菜南方人嘲笑，南方人生吃活物吃各种野味就感觉特别正常，不讽刺吗
1,辽宁加油，大连加油！！！！！
1,吉林能不能行啊，GDP垫底就算了，这个肺炎别争垫底了行不？
1,动了动了！
1,吉林啊，俺们辽宁都下炕了，你干啥呢啊，别喝的离了歪斜的，赶紧的啊，干点正事啊，吉林响应，吉林响应，吉林响应，吉林响应，吉林响应，快顶
1,吉林政府想什么呢，经济落后也就算了，啥啥都要最后一个，有意思吗？吉林吉林吉林
1,这么多省我只佩服山西政府，不管你急不急，反正他不急
1,陕西你是在等秦始皇下圣旨吗
1,重视一点！陕西一级响应？！现在就同学群在这慌，村上啥都不说？！我们慌有啥用，要政府有何用！我妈该说着去岐山走亲戚，可是岐山都有确诊的了！
1,9岁？？？？？
1,可不可以官方开一个直播间，大家可以刷礼物直接到国家的手里！比给平台捐款要快很多！14亿粉丝的力量很大！！
1,陕西刚刚新增10例了一级响应呢
1,所以为啥陕西还不一级？
1,陕西可以一级了，来自刚催出一级的辽宁老铁的关怀
1,说是探亲，就是逃离
1,陕西！！！陕西！！！陕西！！！！启动吧
1,陕西作为湖北的临省尚未启动一级响应！！！在武汉封城后，西安市仍对从武汉抵达西安的2100名旅客放行，对新型肺炎14天的潜伏期视而不见，对发热不是唯一首发症状充耳不闻。西安是陕西的省会城市及重要交通枢纽。如有漏网之鱼，后果不堪设想。恳请相关部门对陕西民众负起责任。
1,不止武汉关注下周边吧我们大荆州已经沦陷了
1,我觉得国家应该关注一下县城农村，根本没有防御意识，该干嘛干嘛，村委会到现在也没统计武汉回来的人。还全村溜达。全国还是农村人多吧。只防御城市有什么用。春节都回家过年了。
1,陕西你醒醒啊！一级响应搞快点！求求了！
1,24小时直播疫情可以吗？不想看春晚回放了！
1,陕西等秦始皇发令呢
1,为啥还要探亲？千里送病毒你亲戚就高兴了？
1,啊我的老家啊，铜川市，本来还打算回老家拜年，后来这几天一直很严重就取消了计划，就安安静静在家宅着，大家多注意防范
1,家里有孩子的人很怕很怕很怕很怕！！！！！
1,陕西你急一急陕西你急一急陕西你急一急陕西你急一急陕西你急一急陕西你急一急陕西你急一急陕西你急一急陕西你急一急陕西你急一急陕西你急一急陕西你急一急陕西你急一急陕西你急一急陕西你急一急陕西你急一急陕西你急一急陕西你急一急陕西你急一急陕西你急一急陕西你急一急陕西你急一急陕西你急一急
1,陕西你倒是急一急呀!!!陕西你倒是急一急呀!!!陕西你倒是急一急呀!!!陕西你倒是急一急呀!!!陕西你倒是急一急呀!!!陕西你倒是急一急呀!!!陕西你倒是急一急呀!!!陕西你倒是急一急呀!!!赶紧采取措施，这都十五个了新疆三个都已经一级响应了咋心这莫大大呢!
1,祸害陕西人呢
1,我村有一个确定从武汉回来的今天村长来说会上报，但是还有两个有人说从武汉回来，他们自己说从南京回来，所以不确定，我真的好着急，他们不说实话有什么办法，家属今天还来我家串门了
1,球球大家关注一下湖北其他地级市吧，都缺试剂缺物资缺人员啊本来医疗水平就比不上武汉，现在物资也缺乏，让不在武汉的湖北人怎么办？宜昌只确诊了一例（已死亡）可宜昌常住人口超过四百万啊湖北省内从武汉回来的人更多啊！好多都没有确诊啊！拜托大家关注一下湖北其他地级市吧
1,陕西为什么不上级，政府不重视，省民也不重视
1,请陕西发布一级响应❗️请陕西发布一级响应❗️请陕西发布一级响应❗️请陕西发布一级响应❗️请陕西发布一级响应❗️请陕西发布一级响应❗️请陕西发布一级响应❗️请陕西
1,陕西尽快启动一级响应落实到乡村排查武汉返乡人员
1,我是陕西咸阳彬县的，有武汉回来的人肆意探亲聚餐没有任何管制措施
1,真是服气了，，20多号了还跑啥陕西还不一级？？
1,九岁？这是刷新确诊病例的年龄新低了吗
1,请陕西政府启动一级响应！！！！！！
1,山西陕西辽宁政府你急一急你急一急你急一急你急一急你急一急你急一急你急一急你急一急你急一急你急一急你急一急你急一急你急一急你急一急你急一急你急一急你急一急
1,跟湖北接壤，却啥措施都没看到
1,请陕西省一级响应！请陕西省一级响应！请陕西省一级响应！请陕西省一级响应！请陕西省一级响应！请陕西省一级响应！请陕西省一级响应！请陕西省一级响应！请陕西省一级响应！乡镇全靠学生科普？还要被嘲笑，麻将摊子能管一下吧？统计的武汉返乡人员统计好了但是宣传啊执行力太低了吧！
1,1.20还出来探亲？什么父母啊
1,陕西！！！真的喊累了，陕西知不知道自己和湖北挨着？？？算了，陕西要是一直都真正只有5例确诊，没有漏报瞒报虚报的情况。不启动一级响应我也支持。
1,陕西政府到底在干嘛？？？？！？！！！！！？？？？？？
1,虽然说最小的是2岁但9岁也很……………………
1,就这陕西政府还不急抄作业也不会？
1,陕西还不启动一级响应吗，能不能重视一定，现在西安路上还有人不带口罩
1,请陕西发布一级响应❗️请陕西发布一级响应❗️请陕西发布一级响应❗️请陕西发布一级响应❗️
1,这么小
1,还是我大河南威武，其他省份学学我们河南，非典时就做得很好，当时我还在小学记得好清楚去乡下所有村子都封了，我爸想接外婆来城里都接不出来，不给外出人员回乡也不允许出来，好多大半夜翻沟回去也被赶出去了，还以为全国都一样，现在才知道有些地方的官员多不作为！
1,这是探亲？这明明就是谋杀！md，多少年没来了，这时候探亲？在家待着不好么？跑来害人！
1,才9岁啊好心疼那该死的吃野味的憨批气的我点眼泪了！！！诅咒ta干嘛要害我们
1,陕西！隔壁山西为自己家还有隔壁同胞担心！！希望两家政府快快落实❗❗❗❗❗❗❗❗❗❗❗  人民相信你们❗❗❗❗❗❗❗❗❗❗❗
1,又是去探亲？？
1,陕西作为湖北的临省尚未启动一级响应！！！在武汉封城后，西安市仍对从武汉抵达西安的2100名旅客放行，对新型肺炎14天的潜伏期视而不见，对发热不是唯一首发症状充耳不闻。西安是陕西的省会城市及重要交通枢纽。如有漏网之鱼，后果不堪设想。恳请相关部门对陕西民众负起责任。
1,陕西你急一急陕西你急一急陕西你急一急陕西你急一急陕西你急一急陕西你急一急陕西你急一急陕西你急一急陕西你急一急陕西你急一急陕西你急一急陕西你急一急陕西你急一急陕西你急一急陕西你急一急陕西你急一急陕西你急一急陕西你急一急陕西你急一急
1,他们才不是口号里喊的“无论生死”，他们也是人，是谁的父亲母亲，是谁的儿子女儿，是想要回家团聚盼着过年的普通人啊​​​！哪有什么岁月静好，不过是有人替我们负重前行。如果这世上真有守护神，那一定是医生的模样。​​​
1,陕西放进来的2100个武汉旅客能不能重新排查隔离？？？鬼知道他们是不是在潜伏期
1,同在陕西后天亲戚结婚要大办酒席我劝也劝不动还说结婚是人生大事哦哦我们的命不是大事了呗还说我们不去不给面子
1,陕西有的学校已经通知补课活动取消了而我们学校没有动静
1,真的日了狗了刚给我爸妈说了商洛已经确诊了然后过了两分钟人家要出门买过年的礼品我真想知道脑子里面除了无知根深蒂固的思想有没有装一点点理性呢
1,希望陕西政府重视！！！！！！！
1,病毒变异了
1,请求通报陕西所有确诊病人的情况！
1,20号还探亲？……
1,山西陕西手牵手谁先动弹谁是狗
1,求求关注一下我们湛江吧！7万人要逃到海南，现在海南进不去，都滞留在湛江！然而湛江不作为！一个都不重视！大街上没几个人戴口罩！这么多很害怕湛江变成第二个武汉！这里医疗水平又低，真的很害怕！！！！  ​
1,陕西你急一急
1,愿看到或没看到这条评论的人都给本锦鲤健康的活着
1,20号还探亲呢
1,我是咸阳的高中生，初八开学补课，学校人员很密集，我觉得很危险，不踏实，请有关部门重视
1,陕西醒醒你上热搜了
1,不知道你急不急，反正我是看不到你急，15例了，重视一下吧，加强各市各县各个乡镇村的宣传力度和排查，很多长辈对这件事不以为然，他们不用微博不能对这件事有具体的了解，依然顽固的往外跑走亲戚串门聚会赶集，这样真的很危险，说句不好听的他们固执不要命，还有很多人惜命啊！采取强硬措施
1,陕西一级响应啊！！！安康和湖北交界，这里好多湖北的车都开过来了，能不能管一管！
1,昨天那个年纪小的孩子感染机会小的热搜，让好多憨憨以为年纪轻和小孩不会感染！
1,真的希望官方发布消息不得举办生日宴会和婚礼宴会等，这种不想去还不得不去的人太多了吧，超级容易感染的啊​​​
1,探什么亲，现在这个时候能不能老老实实在家呆着！
1,山西吉林辽宁呢？？？
1,请陕西发布一级响应❗️请陕西发布一级响应❗️请陕西发布一级响应❗️请陕西发布一级响应❗️
1,山西！！！！！快点行动！！！！
1,陕西快一级响应！！！
1,内蒙古！！！！！！！！
1,求求大家关注一下环卫工人，他们基本都是老年人，全年无休上班，天天接触垃圾，但是没有口罩！！！！！！！​​​
1,山西
1,辽宁政府你急一急辽宁政府你急一急辽宁政府你急一急辽宁政府你急一急辽宁政府你急一急辽宁政府你急一急辽宁政府你急一急辽宁政府你急一急辽宁政府你急一急辽宁政府你急一急辽宁政府你急一急辽宁政府你急一急辽宁政府你急一急辽宁政府你急一急辽宁政府你急一急辽宁政府你急一急辽宁政府你急一急
1,山西?
1,山西！！！！！！
1,吉林辽宁重视下吧
1,山西zf能不能醒醒啦
1,山西我说累了
1,山西陕西，大力宣传可以吗
1,山西呢？？？？？？？
1,陕西甘肃陕西甘肃陕西甘肃你们两个醒醒醒醒醒醒！！！！！！！！！求求你们了还有保护好医护人员物资物资物资物资跟上啊啊啊啊啊啊啊啊啊啊啊发国难财的biss希望全世界都平平安安
1,看看湛江吧，好几万鄂A车辆滞留在湛江港口，现在散布在湛江各个角落和度假区了，街上也没几个人带口罩，能不能管管
1,内蒙古寻思啥呢
1,我主要想知道一级响应是什么措施....
1,陕西！！！！！！
1,辽宁领导班子还没醒酒呢？
1,宁夏呢？？？？
1,辽宁睡觉去了？
1,吉林省领导在干嘛吉林省人急了吉林省人急了吉林省人急了吉林省人急了吉林省人急了吉林省人急了吉林省人急了吉林省人急了吉林省人急了吉林省人急了吉林省人急了吉林省人急了吉林省人急了吉林省人急了吉林省人急了
1,甘肃呢！！！！！！！
1,吉林省！！你看不到吗！！到底是谁给了你自信不发布一级响应？？
1,现在每天睡觉前最后一眼和起床第一眼都在关注疫情进展，每一个沉重的数字都十分揪心。加油武汉，加油中国，大家提高警惕，做好防护，从容应对，热心帮助，我们争取早日战胜新型肺炎！
1,吉林呢！！！！东三省就剩吉林了吉林请启动一级响应东三省就剩吉林了吉林请启动一级响应东三省就剩吉林了吉林请启动一级响应东三省就剩吉林了吉林请启动一级响应东三省就剩吉林了吉林请启动一级响应东三省就剩吉林了吉林请启动一级响应东三省就剩吉林了吉林请启动一级响应东三省就剩吉林了
