1,说得好像我们能买到一样去跟红十字会要吧
1,建议直接发给红十字呢，我们老百姓反正买不到
1,普通的都买不到，去向你们领导呼吁吧
1,十天建一个医院，出不来一批物资，别问，问就是武汉政府特色
1,红十的工作人员和政府领导不都戴n95吗？跟他们说去，百姓连普通口罩都买不到
1,你跟我们普通老百姓呼吁啥？？我们连普通口罩都买不到，你和领导们说啊！你看看他们脸上的n95
1,讲道理，除了网上的n95口罩图片，我现实一个都没见过
1,半个国家养不起一个武汉
1,病毒不可怕，可怕的是人心。是整个国家都病了。人民各种无知，各种盲目跟风。机构各种乱，漏洞百出，管理不善。媒体各种胡说八道，一会权威发布，一会相互辟谣。而有多少在前线的人员得不到最基本的保障。加油！！
1,这某领导看见了得红眼吧
1,是留给领导还是留给武汉？
1,现在的问题已经不是把n95口罩留给医护人员的问题，而是除了武汉市民以外的人根本买不到一次性医用外科口罩！！！
1,问领导拿呀和我们说有用吗我们能买到吗？人家一箱直接扛走的呢
1,想起大大刚上任的时候说过我将无我，不负人民。这些年反腐工作做了这么多，为什么还会有这种事情发生，让人民群众如此失望。真的应该好好查查这帮人，不要让红柿子践踏我们的心意！
1,丢人，可笑，日产千万还不够医护用，还有那些捐赠的物资不知道藏哪儿去了
1,您这是呼吁谁呢？一个一次性的食品级别的口罩我都用了两三天，您呼吁我把N95留给一线医护？？？？我配吗？？？？
1,愤青是救不了国家的  你一个底层的都看不见的东西上面或许更看不见通过现象可以看见本质是可以但千奇百怪的现象你先看见了并不代表除你以外的所有人都有包庇罪少一点跟风和刷屏就会有更多有用的现象出来而不是那个车牌号乱来的也只是少数人当务之急先是疫情在是整顿
1,我们可以省，也请捐过的物资送给需要的人手里！
1,我也得有才行
1,普通百姓连口罩都买不到，你这个呼吁有啥用
1,红十会，解释人手不够，物资还要，有空给人流，没空给协和。前后言语不搭1.6万改成1.8万，还问凭甚分医院三六九等？人流几天1万2，三甲正吃紧。红会领导小老婆天天人流？前记者被阻，今鳄鱼开进红会仓库，喜提一箱3口罩。给谁？给领导。医生？一边去，全是病毒！求协和医生要口罩视频和鳄鱼视频真假！
1,老百姓买不到，医护人员用不上，不知道那么多口罩都去了哪里
1,知道知道，我们连普通口罩都没有见过，别说N95
1,人民日报，你要搞清楚，我们老百姓都不算人哪来的口罩你去红十字和湖北省的领导们门口喊，好吗？？？
1,普通口罩咱普通人也买不到，何况？不用操心啦！
1,建议把图片上的健康人三个字修改为领导们
1,我转发有啥用，叫红十字会吐出来才有用
1,说的好像普通人有外科口罩似的。。。普通口罩都特么完全没了。。还跟老百姓要东西
1,我们没留么？我们普通人现在根本买不到n95口罩好么！大家把口罩捐到疫区，然后疫区的医护人员也没拿到！为什么？你告诉我为什么！新闻天天播生产口罩的厂家涨三倍工资给员工，日产多少多少，产了这么多捐了这么多哪里去了！
1,我们连普通口罩都没有真的
1,我在广东一个小村子，我爸要守村口，但是口罩严重不足，村委只派2个口罩，这两个口罩要用8天，家里也没口罩了。普通民众真的没口罩用了啊
1,普通人能买到口罩都已经不错了，哪里都告急
1,n95不是拿给领导用了么我们普通老百姓也买不到啊
1,呼吁老百姓有啥用，都捐过去了红十字爽翻了
1,请转告一下武汉某红会吧，他们负责分配物资，我们连普通口罩都买不到的！
1,中国人理解不了澳洲大火为什么半年不能灭，外国人也不理解我们为什么要封城，而我理解不了社会捐款也那么多了，武汉医院依旧紧缺物资
1,无语你先把红字会的发完再来呼吁行吗？？？？
1,哈哈哈哈哈哈哈哈哈哈哈哈哈哈哈哈哈哈哈哈哈哈哈我们连普通口罩都买不到，转给谁呼吁呢
1,那些说刷车牌很烦的，相关热搜撤的一干二净，如果连这点都不坚持，你看，那些狗官又该多得瑟，骂故宫大G不能刷骂野味不能刷骂海鲜市场余甜不能刷骂车牌不能刷骂红十不能刷……是什么都不能刷，问题是什么都没解决啊。十年一轮回，大家再一次忘的一干二净，你看，大家多健忘（我复制的）
1,周总理，您看到了吗？大G开进故宫，某公务车特权领口罩。这盛世如您所愿吗？！
1,湖北呢
1,那些说刷车牌很烦的，相关热搜撤的一干二净，如果连这点都不坚持，你看，那些狗官又该多得瑟，骂故宫大G不能刷骂野味不能刷骂海鲜市场余甜不能刷骂车牌不能刷骂红十不能刷……是什么都不能刷，问题是什么都没解决啊。十年一轮回，大家再一次忘的一干二净。你看，大家多健忘。
1,湖南真的太难了帮帮湖南，确诊人数也很多
1,现在各种新闻、热门微博下面一群人一直锲而不舍的刷车牌号，不是已经说在调查了，怎么还在这儿狂刷，是图什么？
1,车牌查清楚！
1,想要做慈善，首先要躲过某慈善机构，你说奇怪不奇怪
1,红十字会现在一点热度都没了！大家可以问车牌，我不反对！但麻烦关注一下红十字会分发情况！车牌也有可能是用来转移视线的大家别中了他们的调虎离山之计！
1,湖北湖北
1,我看最该革职的是武汉马书记吧
1,这世间唯太阳和人心不可直视。疫情期间，人心比病毒还要难防。加油吧加油
1,湖南又做表率了，湖北还不赶快抄作业。
1,湖北应该全员下岗
1,四个人三个娄底的这几天确诊人数又增加了不少
1,划重点:停职！！！不是撤职！
1,求别乱喷了，不要乱带节奏，也不要被乱带节奏。现阶段最重要的是疫情，国家一直在做事，有饭吃有医院保障，火神山雷神山交付在即，今天有空军送物资，火神山直接接受物资！！都在做看不到吗？湖北暴露出了很多很多问题，但是不要随便上升到国家好吗？！中央会一步步解决！！团结！加油武汉，加油中国！
1,预感待会儿这个“负责人”出来，说着2020官方最流行的词语自责内疚痛心
1,“这大清的天下是我们大家的！”
1,我一个湖南人在外省，都担心湖南疫情，无作为的官！拿人民群众的命当儿戏！太让人寒心了
1,湖南好样的，湖北呢？失声了？
1,湖北呢？动不得？
1,不查查湖北吗？
1,官字两张口，说话有两手！
1,那些说刷车牌很烦的，相关热搜撤的一干二净，如果连这点都不坚持，你看，那些狗官又该多得瑟，骂故宫大G不能刷骂野味不能刷骂海鲜市场余甜不能刷骂车牌不能刷骂红十不能刷……是什么都不能刷，问题是什么都没解决啊。十年一轮回，大家再一次忘的一干二净，你看，大家多健忘（我复制的）
1,严查红十字会严查红十字会严查红十字会     严查红十字会严查红十字会严查红十字会
1,反腐倡廉好几年了，看来没啥成效
1,湖北呢？除了一个免职？？？一线城市的犯错就格外牛逼了？？看不见？？
1,也看看我们湖南吧！！！
1,有本事动下湖北的人给我们看看呀不是免职是撤职敢吗
1,湖北真的是从上到下的烂了，疫情之后，好好查办吧，就算不是给老百姓交代，国家前途来讲，清除了这些占着位置不干人事的，也是一件好事!
1,武汉市政府的呢湖北省政府的呢
1,人民日报滚啊，什么时候代表人民了？？？
1,请查湖北！
1,又是河北又是湖南的！湖北呢？？？
1,啥时候把湖北红会的那几个抓一下
1,湖南替湖北背锅？
1,严惩不负责官员！
1,车牌多少来着？
1,车牌呢
1,2020年2月1日，02:15，湖南省计生委生综合监督局局长张辉，15天奋战在抗疫一线走了。我希望的是官做好官事，民听好安排，互相帮助，从来没有人生来就应该保护别人，不好的赶快过去吧。
1,湖北呢
1,红十字会
1,多关注关照湖南吧，湖南的疫情也很严重
1,买车一定要买大G，还要挂
1,尴尬啊湖南两次热搜都是挡枪之前增长70多50多硬是不上热搜湖南原住民都不想看微博也不想争抢些啥了吧
1,预言解释司机个人行为，是临时工已经辞退。
1,疫情结束后，一定要枪毙一批执政不为民、发国难财的狗官奸商，否则民愤难平
1,湖北呢？？
1,湖北红会呢
1,车牌？哦！你说的是2月1日下午两点多一位临时工在黑色十字路口地上不小心扣出一箱子M3口罩说送给大家的包工头那辆车的车牌吗？当时车速太快，从在我眼前到我看不见只花了十来分钟，所以车牌我不记得了，只记得它的车型是……呃……A级零号且耗电二百六十瓦的小轿车。（号要没一起没，复制～）
1,车牌号查清楚！！
1,没想到我冷水江上人民日报是因为这个。。。。
1,去买报纸，要一份《人民日报》。报贩回答《人民》没有了，只有《日报》。
1,希望真的跟进这进一步调查，过了风头官复原职的戏看厌了
1,停职和免职的区别在哪里
1,武汉呢？湖北呢？除了几只小苍蝇还有别的吗
1,希望一起处理，别官官相互了
1,省长班子还有武汉市长班子都撤了吧。
1,湖北呢武汉呢
1,湖北的呢
1,停职好，又不是开除免职，正好避避风头，疫情一过，东山再起
1,伟大的中国梦！
1,湖南，天津，河北，黄冈都被问责了。武汉呢？湖北呢？
1,官太小，没劲
1,湖北的那些尸位素餐的领导什么时候处理？
1,其他省或许也存在这种情况啊
1,湖北呢
1,停职是？
1,蛀虫真的多
1,给大家讲个笑话，我买到了我自己捐的物资
1,钱也是老百姓的，口罩也是老百姓捐的，到头来发现老百姓连看一眼的资格都没有！
1,爆锤湖北红十字会
1,红十字公开明细了嘛？怎么开车给领导送的物资都没人查？还有那些说带节奏的人，追问事实真相有错？如果不是这些天网友们的呼声，很多问题它能暴露出来吗？你不带节奏，那你倒是拿出来证据呀？你是领导家亲戚吗？永远别忘了人民群众是干嘛的！我们都想推动各项工作落地，迫切希望疫情早日结束。
1,红十不是还有好多嘛！！！去要呀
1,捐了那么多东西到底去哪了？
1,去找红十字，我们买不到，都在他家仓库压着呢
1,为什么都是要社会捐了，这不应该是政府的事吗，它才是主力啊
1,捐了那么多。。。怎么还缺？？？？？？？？
1,国家那么有钱，现在又把物资都征用了，凭什么我们来捐？
1,所以，前面大家捐的，都不算数了？
1,不捐了  人民也捐不动了……捐了贪贪了再捐   人民捐钱捐东西是让救命用的  不是让那些吃人血、吞噬百姓血肉的恶魔挥霍生财的！那就是一个无底洞！人民百姓真的填不动了……
1,不要到网上发捐助信息了，麻烦请求国家给红十字会压力！
1,今年最大的笑话就是武汉缺物资
1,跪求红十字会开仓赈灾吧，求求您们高抬贵手，放过人民群众，放过医院，放过医务人员吧，我们斗不过您了，但我们真没有再多再多的物资供养红十字会了！或者，要不您们开个价，还要多少钱存进个人账户才放过医务人员，我们众筹给您！
1,能不能到医护人员手中？
1,等您把红十仓库清空了，前线真的告急，且有直通前线不被截停的渠道，我捐！
1,我去……我们真的是能捐的都捐了，麻烦找红十字会要啊，他们吞那么多是要留作古董吗？
1,之前红会收到那么多物资怎么处理？现在让大家直接捐给医院，那红会仓库的物资呢？红会自己咪了再卖还是免费给领导？
1,青菜我们也得拿钱买，口罩我们也买不到，贵省我们真的养不起
1,这应该是国家的事，找工厂专做不比让群众乱捐要快要好吗？群众把世界各角落的搜罗来，全堆十字会说不是医用的不发，群众实在没有了，与其在这搞捐献，不如增加生产线，我们去当义工也行啊
1,去跟红会要吧.....我们普通人，真的真的，也买不到了
1,谁爱捐谁捐
1,我倒是想捐，可是我也搞不到口罩啊，年初就在捐想着时间紧迫政府也需要时间调配物资，先紧着一线的医护人员吧，我们这些十八线小城市的就尽量不出门，可是这都十天了，一线还是急缺老百姓也买不到
1,找武汉红十字会要啊？为什么都要找人民群众要？我们买得到这些东西吗？政府没有找我们要这合理吗？
1,他们现在的做法对得起他们的前人、我最敬佩党员周总理吗？死后骨灰洒向大海，生要为人民服务，死也要为人民服务。
1,现在看到这种公告都觉得来气了所以红十字会的那些呢？？？就不用分下去了？？？！又来要老百姓捐一遍？？？
1,持续发问
1,社会上的都捐了，况且这上面的物资也没有流向社会，为啥你会觉得社会还有东西
1,钱也捐了，前方还是没东西用，其实我们这些捐钱的小老百姓也没有口罩啊，也没钱(=_=)有钱有物的动也不动，只会痛心  自责  内疚……
1,百姓一滴也没有了……医院没有百姓没有…湖北也没有非湖北也没有…几百万的口罩人间蒸发了
1,我突然想到建国大业里蒋经国的一句台词，有些人正在侵蚀这个国家的根基
1,那
1,找红会，我们没有了
1,金银潭医院又没有物资了，可是红十的物资分配公示还是没见到，你以为普通民众是有多无聊啊，总去刷车牌刷红十，可是又有什么办法呢，大家都是希望奋战在一线的战士能有一些安全防护啊，我们只想要一个公道公道公道，可是能怎么办呢，除了口诛笔伐还能做什么呢？??
1,删新闻撤热搜这么快为何物资发放这么慢武汉政府派人开车进仓库拿取物资畅通无阻为何医生拿信苦等一个小时只给500口罩为何医院物资各种奇缺领导却要“紧平衡”而大量物资堆放仓库
1,东西跑哪去了
1,找红十字会要！！！
1,金一南教授说你可以欺骗上级，欺骗群众，欺骗父母，欺骗朋友但你永远欺骗不了敌人，因为敌人时时刻刻要你的命。这场疫情彻底改变了许多人对中国的认识！
1,各个物资紧缺的医院，你们直接去红十字仓库抢吧，我们老百姓是真的没有了
1,市民都缺口罩
1,我还捐尼玛啊
1,立即去仓库找肯定有  带好视频直播全国人给你作证
1,就问一句，红十字会的库存清空了吗？
1,大江南北捐的物资供不起一个武汉，你在逗我吗
1,感谢大家之前半个月为湖北官员及其家属的捐献，大家如果还有物资钱财可以给医院捐了，嘻嘻
1,不是都在武汉红十字会那边吗
1,真的没了，都空了，你们问问武红十吧
1,红十字仓库不是满的吗找他们要去啊
1,没东西捐了我们都没有问红十字去啊！
1,全国的口罩各种物资都去支援了，为什么还是不够前线的他们该有多难啊
1,我都买不到买得到的全捐给红十字会了
1,捐屁，老百姓家里也没有余粮啊
1,？？？听说某会可以一次一人给一箱N95找我们干嘛？？？
1,全世界的中国人给武汉捐物资，然后物资还是短缺？真他妈是见鬼了。
1,让我们大G做伴活得潇潇洒洒，
1,全中国的人都供不起一个湖北省是吧？几个意思啊！不捐了，等si吧！
1,我们对人性最大的误会就是以为只要是人都会有点人性和良心
1,调拨黄冈市N95口罩1.3万个，仁爱医院一家就1.8万个，你品，细细的品
1,人民日报你倒是去劝劝红十啊我们的钱国家的物资  除了自留各省医院全给了武汉红十了他们是人？？
1,红会是真的死了
1,请问直接开车去红十字会仓库取可以吗？我看网上视频都这么做的
1,除了民间捐赠，武汉市政府，湖北省政府难道没有采购准备吗？
1,问题老百姓自己都没有口罩了啊，我们压根买不到，商家一问就是先送武汉了先支援武汉了，武汉还缺还缺我们真的买不到了
1,两辆车刷新了我的价值观
1,去武汉红十字要去，都在他们那
1,那辆车能不能借给金银潭开开
1,非得一个肺炎逼的你们公示善款？大家一起呼吁，以后所有官员也必须公示财产
1,我们还能信任谁啊？
1,病毒不可怕，可怕的是人心。人民各种无知，各种盲目跟风。机构各种乱，漏洞百出，管理不善。个别媒体各种胡说八道，一会权威发布，一会相互辟谣。而有多少在前线的医护人员得不到最基本的保障，希望一线的医护人员照顾好自己，家人都在等着你们凯旋，加油！
1,居然不是湖北？？？
1,河北发布死了么，天天数据不更新，不具体，不透明，到现在河北疫情全特么靠小道消息
1,你们一些留言红会的人是不是够了？现在这事全国上下都也知道了，每天有更多的新闻要值得我们关心也要我们监督啊，特别一些营销号和复制粘贴狗，其它地方任何新闻都也值得我们关注，所以留些空间给全国各地的新闻一些关心和关注。谢谢！
1,河北这工作太省心了，每天数字一改拉倒，什么，你问具体是哪个县的，风太大我听不见，河北官博还关闭评论，群众都没有地方表达意见
1,2020官方最流行词语痛心内疚自责
1,请求全天候直播红十字会发放物资请求全天候直播红十字会发放物资请求全天候直播红十字会发放物资请求尽快审计红十字会物资帐目请求尽快审计红十字会物资帐目请求尽快审计红十字会物资帐目请求尽快审计红十字会物资帐目
1,讲个笑话我买到我捐赠的口罩了
1,我就奇了怪了，怎么不是湖北咧？？湖北的人真的就是动不了是吗？腐败成这样了？拿地方官员的错来填补湖北省政府的错
1,我都觉得河北不正常。什么也不公布，都不知道确诊的是哪个县村的。能不能向别的地方学学
1,车牌是啥来？？？
1,滴~滴滴~滴滴滴滴~滴滴滴~
1,河北省各个阶层腐败，县到村之间更为明显，只贪钱不做事，这种歪风邪气像瘟疫一样
1,湖北的什么时候问责？
1,求求河北具体公布到县吧
1,最应该辞职以谢天下的就是湖北的地方官。
1,河北赶快公布详细信息！！！
1,张家口宣化区第一例书法家确诊患者一个人传染了一大片，旅游途中发病不去看医生，回家以后工作娱乐两不误到处乱跑，这下倒好全家都确诊了，他们小区现在都封起来了，这事在我们这边都成笑话了，估计是因为这事吧
1,中华人民共和国刑法释义第273条【挪用特定款物罪】挪用用于救灾、抢险、防汛、优抚、扶贫、移民、救济款物，情节严重，致使国家和人民群众利益遭受重大损害的，对直接责任人员，处三年以下有期徒刑或者拘役；情节特别严重的，处三年以上七年以下有期徒刑。
1,石家庄两天前将15号之后武汉返乡人员聚集隔离了解一下吗
1,最神奇的是武汉没有一个被问责
1,删新闻撤热搜这么快为何物资发放这么慢武汉政府派人开车进仓库拿取物资畅通无阻为何医生拿信苦等一个小时只给500口罩为何医院物资各种奇缺领导却要“紧平衡”而大量物资堆放仓库
1,河北省一天除了报告地级市的数量，其它什么都没有，大家人心惶惶的乱猜，路上人依然不戴口罩
1,等的宣化发现疫情了，高速口才一个个查体温，之前都当摆设站着
1,能不能公开病例具体情况
1,宣化区人民表示开心没白举报
1,老子真他妈服了，18年就因为吸入雾霾生了一场大病，，你们这些河北破官一天天不管事，收钱包庇污染企业，打压百姓，河北因为清洁煤炭死了多少人?现在肺炎也不好好做措施，，瞒报还不公布具体信息，就他妈你们北京官河北官是人吗，一群死猪
1,活该河北作为了吗？作为个屁我就骂你骂你就tm骂你你作为了个几？真不争气活该配不上京津
1,严惩
1,严查
1,又开始痛心内疚自责了
1,这种新闻不用报道吧，你快报道报道湖北红十字会的人怎么处理吧，宣化区目前发现了6割都这种，黄冈卫建委就免个职？？
1,别刷别的了好么，在这赶紧管管河北，别形式主义，他妈的我们小区现在给电梯扣停了，这时候他妈的得排队去交物业费，不交电梯用不了
1,希望可以公开宣化病人的大概街道啥的
1,都像河北这样的，至于疫情严重成这样，湖北官员个个肥头大耳，无能至极
1,为什么这么多省份被问责武汉红十字仍然屹立不倒？
1,河北的不具体公布，早就该问责了。
1,多少蛀虫。
1,我有个问题，这些地方疫情并不严重，领导被问责。武汉湖北红十字各个机构领导玩忽职守，公报私仇假公济私草菅人命，对基层需求不闻不问怎么不问责？一直保着有意思吗
1,河北疫情为什么不公开透明？？？
1,湖北的不处理，先把河北的处理一批
1,官字两张口，说话有两手！
1,张家口具体信息！张家口具体信息！张家口具体信息！张家口具体信息！张家口具体信息！张家口具体信息！张家口具体信息！张家口具体信息！张家口具体信息！张家口具体信息！张家口具体信息！张家口具体信息！张家口具体信息！张家口具体信息！张家口具体信息！张家口具体信息！张家口具体信息！
1,整个张家口都是个别县一两个   只有宣化区一下子病了三个这三个病了的在区里转悠了10天才去医院不罚不合理该罚   我在赤城从大年初一就开始禁严了不出门  封路  真不知道宣化区政府在干嘛现在搞得整个张家口市人心惶惶
1,河北比湖北强不到哪里去
1,作为一个张家口人我觉得好丢人，其次就是河北政府呵呵，湖北算好的
1,河北能公布一下具体信息吗？你看看你隔壁河南和天津，作业都抄不好
1,河北天天靠小道消息！也不详细报道，住附近的大家也好自我保护或者自我隔离一下啊……都不知道是哪，每天只见数据不断攀升，徒增恐慌
1,前好一段时间宣化开始传泰国回来的一家三口疫情，几天前才发布确实消息，这两天又开始传一家三口中的爸爸代继光先生已去世，传的挺开了，官方你倒辟个谣或者公布一下啊。不满的地方何其多，真该好好查查河北了
1,河北只能看到邯郸的几个几个石家庄几个几个，邯郸就一个市啊？你不说我都以为是市里面的？
1,这种身在其位不负其责的太多了赶紧好好整顿吧
1,我就是河北的，跟你们说一下这个全覆盖到户具体的做法。就是有个人到我家，问我家有没有武汉回来的，然后就没了。河北疫情消息更新不及时，没有患者时间线，各种消息都靠小道消息，谣言到抓的特别紧。
1,谢谢。没事多查查省会石家庄。
1,终于到河北了，赶紧排查吧……一点安全感都没有啊
1,河北这种现象很多好不好，哎汗颜
1,挪用救灾物资的，是不是得枪毙
1,这段时间每天打开微博都会怀疑人生
1,河北什么时候能公布具体到县区全靠私下传，我怎么知道我接收到的消息是真是假看了两天河北新闻了，就整天开会开会开会。。。
1,小官都是替死鬼
1,大家不要买发货地是武汉的口罩之类的啊！！！！！！！不然他妈的买到了自己捐的那不是很尴尬！！！！！！
1,赶紧的，公布张家口病例的详细信息，具体到区县，一个小城市，医疗水平也不高，都9例了，还不公布吗？
1,湖北那些不更是控疫不力嘛？怎么还没被问责？
1,河北宣化的政府官员没几个干实事儿的，应该彻查
1,有一说一河北政府除了信息公布做的不好，其他的很不错了！昨天我们村主干道还有车过来大喇叭宣传。村里人也挺重视！河北加油！中国加油！
1,赶快把张家口患者区域分布和活动范围公布吧别让我们疑神疑鬼了
1,宣化上新闻准没好事儿，真的无语了
1,艾玛！人民日报您心咋辣么大呢？
1,河北在干嘛？啥也不公布，这是秘密么？为什么不报道信息，就只给一个人数别的不管了？啥意思
1,河北岂止是这一个区执行力度不够啊，还有很多
1,哈哈哈～除了湖北和武汉，其它都严查了吗？
1,唉，咱宣化第一次上热搜，竟然是被批评，丢不起这人。
1,我的车车不见了，你们帮我找找？
1,来来来，开着特定某A车牌去红十字会随便搬走救援物资啦
1,不聚餐！！！
