1,手握特权的人开大G进故宫，心系百姓的医护人员奋战在一线，致敬，感谢，我们心如明镜，大家加油
1,致敬英雄，祈愿平安
1,加油
1,辛苦了，谢谢白衣天使们
1,感谢有你，盼你平安！
1,愿平安
1,感谢有你们
1,致敬❤
1,致敬❤️
1,致敬白衣天使
1,致敬感谢有你们你们记得也要照顾好自己。
1,谢谢你们！盼你们平安！
1,感谢有你们！致敬！
1,感恩有你
1,感谢有你盼你平安
1,致敬❤
1,武汉周边地级市的情况怎么样了？
1,致敬奋斗在一线的工作者，保护他人同时也要好好保护自己。辛苦了
1,向医务工作者致敬！他们是新时代的英雄！多注意安全…
1,感谢有你，盼你平安
1,只能说祝你们平安归来
1,为医务人员点赞，辛苦啦
1,加油，我的国，当年咱们众志成城的抗击非典，今天我们仍然团结一心对抗肺炎。
1,致敬！
1,愿平安
1,辛苦了
1,致敬一线医护人员
1,该追究责任时请不要煽情！
1,谢谢你，疫情中的逆行者！感谢有你，盼你平安！
1,致敬白衣天使
1,感谢你们来点实际的，给她们涨工资吧
1,愿都平安…
1,致敬
1,我的真心建议，春节电影院最好不去，景点最好不去，串亲戚能不去尽量不去，实在出门也要做好防护措施，为自己好，也为大家好。老实在家看春晚吧，奋战在一线的白衣天使够辛苦了，愿早日消除病毒。
1,武汉新型冠状病毒的阴霾，唤起了人们对17年前SARS肆虐时期的记忆。   其中，一种言论逐渐甚嚣尘上“不是我们战胜了非典，而是非典放过了我们。”   甚至有人“预言”，武汉新型冠状病毒也将在相似的时间，以相同的方式划上句号。
1,医护人员辛苦[米奇比心]      不好意思插播一下1、新型冠状病毒56℃，30分钟，就死亡了。2、乙醚、75%的乙醇、含氯的消毒剂都可以有效地灭活病毒。3、一定要吃熟的食物，不要吃生的食物。‼️我觉得有必要提醒84和洁厕灵千万别混用呐‼️会中毒‼️‼️
1,别乱跑保护好自己别给医护人员添乱
1,我建议每个地方火车票飞机票什么的从现在开始能不能延期，病毒真的很可怕，生命重要，烦请国家从现在开始到病毒渐渐消失停止售所有交通类的票了，好吗?希望看到你们对我的意见!!!
1,（这个人眉毛好长在我家那边是多福长寿的象征
1,祝一线医护人员都平安！祈祷你们不被传染，小心别累着身体啦
1,致敬白衣天使
1,借个地方举报以下淘宝卖家贩卖野生动物  1.爱美膳旗舰店  2.京采泷庆食品专营店  3.青稞牧场  4.纯野味店  5.美人松土特产6.山鲜调旗舰店  7.乐昌人家  8.聚狼优品9.东昊蓝孔雀养殖基地  10.环鄱阳湖绿色生态馆11.淼淼养殖12.小刘珍禽野味  13.原味农家  14.珍鲜湾旗舰店  希望有关部门查验一下
1,感谢有你们！定要平安！
1,他们也是父母的掌中宝
1,河北恐怕是挺不住了我瑟瑟发抖！
1,向在疫情中坚守在工作岗位上的医务人员，警务人员，乘务人员，快递小哥，口罩生产工作人员等致敬！
1,能不能呼吁减少走亲戚
1,武汉医院超负荷运行，好多发烧的当地市民都排不了号，其中还可能有感染病毒的，求支援武汉更多医疗资源
1,如果当初启动紧急措施，严格把控武汉人员流动，避免不必要的外出，现在也不至于全国蔓延了吧。其实当下严格把控也不晚，总比再进一步扩散的好。我们不是排挤武汉人，因为只有这样才能把影响降到最小。
1,江苏拿你的高考题给我吓住阿冠！考它！
1,真的买不到，连护理口罩都没了
1,发国难财的原地爆炸吧！！
1,你吃了野味，全国乃至世界要为你善后
1,江苏挺住！！！听官方的！！！别造谣了！！！！
1,在线等怎么让我爸妈听我的
1,建议全国暂时取消人流量密集的活动，比如影院、景点，我们不能身在一线奋战，但我们尽量别给国家添乱！
1,我们这18县小县城都没口罩了
1,72岁还往外地探亲那个我服了。年纪大了不应该被探马。而且十二月出来的消息1.18号还往外走
1,真的口罩价格暴涨没有应对措施无论怎么呼吁都没有用
1,借地方问一下！用过的口罩要怎么处理啊！扔外面怕万一再扩大传染，也怕剩下的路上会有病毒，带回家还怕把病毒带回来
1,我家是药品批发的。本来都放假了，收到了很多订单，爸爸刚出院就去把口罩都原价发出去了，订货人都说我爸爸人真好口罩不涨价，希望中国挺住！
1,口罩我今天跑了十几家药店都没有买到
1,本来家里人不重视   还说我太紧张了  然后我给我爸妈分享了人民日报的关于新型病毒的文章   还给他们看电视上的新闻   让他们知道我不是乱说   电视上都说了我能乱说吗   见效显著   我爸已经说了他明天一大早就去买口罩了
1,还呼吁不涨价，我这边一个18线开外的小农村涨了不止两倍价格，还买不到
1,江苏给爷挺住
1,哎！今天去买口罩，限购又涨价了
1,可以在电视上宣传一下吗老年人不上网完全不重视
1,长辈都不重视啊
1,带口罩吧出门别害人害己了
1,武汉人，不服周！加油武汉！
1,听到了吗黑心商家发国难财真的没有心！
1,普通口罩有用啊？你们认真看视频了吗？说了医用也说了没有医用普通口罩也可以，为什么现在都传成了医用口罩啊？
1,建议口罩使用身份证购买，每人一周限购10个。
1,口罩涨价可以理解，毕竟节假日要付三倍工资，人员紧缺，适当涨价我们接受，企业也要生存。但哄抬物价，导致口罩买不起买不到，真的是很过分。不想道德绑架，但是部分网店口罩价格暴增，故意写误导性标题，明明是医用普通口罩，却写医用外科口罩，口罩的防护级别不够，你就是危害买家。真的是发国难财。
1,严禁相互串通，趁机涨价；囤积居奇，操纵市场价格；价格欺诈；哄抬价格等行为。
1,从病患家属微博，已经能看出武汉疫情的严重情况。政府部门做事，总有个错误思路，怕公众恐慌。像这种疫病类事件，在前期怕的就是公众不恐慌，不然怎么防微杜渐？早恐慌早防范，总比疫情雪崩般来袭时再恐慌要强。此次的疫情，没能在最佳时期阻断扩散，跟相关单位缺乏足够的忧患恐慌意识有莫大关系。
1,减少外出别去电影院！
1,能不能多在电视上报道啊！家里人咋说都不重视！！就我们年轻人戴口罩劝他们还不听
1,我好难！我就想过个年！气死了刷微博都沉重
1,呼吁没有用重要是加大生产力度，供给跟上需求才不会恐慌
1,大连聚贤路海王星辰药店，22号早上刚开门口罩还是原价，接个通知后就涨价，说统一调价，还买了不给小票然后官方微博第一条居然是不涨价？？？
1,你们买口罩都是买哪种口罩，网上搜好多，不知道哪一种比较好一点，求链接
1,口罩戴起来，保护自己也是保护他人。
1,借楼举报以下淘宝卖家贩卖野生动物1.爱美膳旗舰店  2.京采泷庆食品专营店  3.青稞牧场  4.纯野味店  5.美人松土特产6.山鲜调旗舰店  7.乐昌人家  8.聚狼优品9.东昊蓝孔雀养殖基地  10.环鄱阳湖绿色生态馆11.淼淼养殖12.小刘珍禽野味  13.原味农家  14.珍鲜湾旗舰店  希望有关部门查验一下，谢谢
1,政府还要继续升级防护措施，农村地区的拜年串亲戚禁止吧，防患于未然！！疫情面前没有“小题大做”之说！！！
1,希望商家有良心，心中有大爱！君子爱财，取之有道！不要赚那些昧良心的钱！希望所有人都平安，疫情尽快得到控制
1,希望过几天我能买到口罩，大家加油生产啊
1,保护自己也是保护他人
1,保护好自己能别出门的不要出门平安最重要
1,求你们别去看电影保命要紧
1,保护好自己
1,不造谣，不信谣，不传谣
1,出门戴口罩！大家都要平安！
1,保护好自己啊一定
1,发国难财
1,在家待着，没啥事别出去了！
1,可我妈不听我的啊
1,口罩带起来
1,好的好的好的我今天就去买口罩了！大家要保护好自己
1,都保护好自己
1,春节期间尽量不要去影院
1,保护好自己就是对他们最好的支持
1,我真的好焦虑
1,大家都平平安安过年鸭
1,加油!!
1,挺住！
1,确诊和死亡数一直涨，治愈数基本没变过啊，阿冠哥，你去找那些吃野味的好不好啊！
1,我还没买到
1,注意啊
1,真的是，几个口罩几百块，两口罩50多块钱，还有10块钱10个但是邮费999，人能不能有点良心
1,服了呼吁也没用  淘宝天价依旧现在能发货的口罩也都没有
1,很多药店都没有货啊！！！
1,我们40块钱一个，10个起卖兰州
1,五个口罩要一百块，小老百姓怎么负担得起啊，父母亲一天才挣百八十块，爸爸上班在公共场合，人来人往是我最担心的，请商家不要发国难财了，非要把人逼死吗
1,口罩生产商辛苦了，这个时间点涨价大家都可以理解，但不要太过分了，唉
1,北京加油儿
1,河北也没挺住
1,故宫的事，日后再算
1,别人我不敢说，就我认识的武汉人，包括我自己，我父母，我的亲朋好友，这个春节会全部呆在家里，不会外出，也不会去外地。请放心。然后祝大家平安。
1,借楼举报以下淘宝卖家贩卖野生动物1.爱美膳旗舰店  2.京采泷庆食品专营店  3.青稞牧场  4.纯野味店  5.美人松土特产6.山鲜调旗舰店  7.乐昌人家  8.聚狼优品9.东昊蓝孔雀养殖基地  10.环鄱阳湖绿色生态馆11.淼淼养殖12.小刘珍禽野味  13.原味农家  14.珍鲜湾旗舰店  希望有关部门查验一下，谢谢
1,如果前期我们多一点关心和重视，也许就不会造成现在的局面！生命只有一次，生命真的可贵啊！！！
1,严格把控武汉吧，别再让人员四散了，多多劝告家里人，别不当回事
1,江苏给我挺住！
1,陕西甘肃青海新疆西藏江苏内蒙  挺住啊！
1,政府不如呼吁一下过年不要走亲戚了，家庭聚餐年夜饭也最好取消吧
1,救命
1,河北挺住了奈何武汉人直接来
1,实时播报武汉周边城市的数据！！身处湖北的一个小县城，多少在武汉读书或者打工的人最近回家！！疫情官方消息还不如其他省份，小县城医疗条件还不好，好些中老年还不够重视这个事！！！
1,真心觉着政府应该把患者的乘车信息公开出来！这样可以提醒一下同车次的乘员和列车服务人员​​​
1,武汉还不封城？！！！干啥吃呢都！死亡人数17了！！！！！
1,艹！
1,陕西新疆西藏青海甘肃内蒙江苏都给我挺住啊！！！！
1,但凡那么几个憨批管住自己的b嘴不吃野味也不至于全国乃至全世界为他们善后
1,潜伏期太长了，好多人不知道自己携带病毒时已经把它带到了全国各地
1,武汉市长根本没做好隔离工作！现在已经蔓延半个中国，几乎所有城市的第一例都是武汉过来的、转机的！请问武汉市长在干什么！
1,铁肺河北没想到武汉人直接来了
1,建议全国暂时取消人流量密集的活动，比如影院、景点，我们不能身在一线奋战，但我们尽量别给国家添乱！
1,这就？？？？我的天
1,为什么武汉现在还不限制出行，现在所有被感染的都因为去了武汉，武汉的人不出来扩散的速度回会降低很多
1,求求武汉的大爷大妈大哥大姐，别可处溜达了，春节假期过了可怎么整啊河北瑟瑟发抖
1,可能江苏太难了，病毒考不进来
1,可使用含氯的消毒剂消毒比如84‼️我觉得有必要提醒84和洁厕灵千万别混用呐‼️会中毒‼️‼️
1,我真的没有别的意思！！我求求武汉市里的人们不要去别的地方了，特殊时期特殊对待，这个年可以不过但是命不能不要，今年不过有了好的身体明年可以照样过！！
1,我相信河北本来能挺住奈何你武汉人直接就来了​
1,他是来探亲了，考虑过河北人的感受吗？
1,能不能政府出点强制措施，近期武汉出来或者去过武汉的人都去医院检查一下，别带着病毒满世界跑了，损人害己，，买票不都是实名制么，从系统库里找人应该不难
1,为什么18号还往外放人呢？
1,河北失守了…陕西加油
1,陕西！挺住！中国加油！
1,天啊河北河北加油啊！
1,这样的传播速度，居然还在探亲难道真的要封闭武汉，当地人才能明白现状嘛！！！
1,刚想说河北还没有，这可就来了，挺住啊
1,石家庄人表示怕怕
1,几乎都是中老年人，然后劝家里人又不听
1,奈何武汉的大爷疾跑加传送来国际庄送塔
1,跟武汉沾边的人。到哪哪儿传播扩散。那武汉本地可见已经是水生火热之中了。现在要做的就是回武汉的就别出来了。没事儿的就别去武汉了。我们其他地区要做的就是尽量避免传播扩散。少去人多的地方。正好赶上过年放假这阵子都家呆着吧。有问题赶紧去医院检查。
1,武汉人别出来了！
1,探亲重要命重要？别四处溜逛了，疫情过去想怎么探亲怎么探亲。
1,我天。。。我大石家庄啊
1,72岁哎希望大家都能够好好的
1,操。。。。
1,那几个吃野味的给爷爬拉上这么多无辜的人为你们善后
1,终究没有躲过，河北加油啊
1,我也要进前线了！希望大家能给我好运fighting！中国加油！
1,探什么亲？？？祸害人家一家人！没你这样的亲戚
1,说实话，我们也知道不应该说什么“武汉人能不能别乱溜达！“这种话，但是他明明自己发热咳嗽还带来石家庄，真的就很生气！！！！！！什么心理啊！！！不知道这是啥时候啊！！！！我又生气又害怕
1,现象只剩下江苏了！！江苏的宝贝们请保护好自己千万！
1,希望不久之后能出现这样的热搜:新型冠状病毒已找到医治方法，钟南山院士以及志愿者医护人员全部平安归来！
1,……我真枯了……家里住的地方，学校都中招了……恨死吃野味的混蛋了以后能不能严查啊！别不长记性作死了行不行……
1,我现在都不敢刷微博了，一刷就来新的
1,河北也没有幸免
1,这是武汉人在河北确诊了，跟他有过接触的六个河北人暂无情况，可能真的雾霾没白吸，挺住，板蓝根口罩消毒水不离身
1,陕西挺住秦始皇保佑
1,武汉的人民不要乱跑了求你们了！
1,我靠这个节骨眼了能不能别探亲了！？！？！
1,我大河北也沦陷了
1,探亲，我，，我特别想口吐芬芳，老人家今年过年病毒这么危险还跑那老远来河北，，我服了我真的没办法做到理解，我是河北人，我也怕
1,72岁你这个节骨眼往外跑……不说肺炎不肺炎的一把年纪这么冷的天往北方跑不怕磕一下碰一下的？不怕冻坏了？？家里人也放心他大过年的跑出来这么远
1,就在刚才！还在为我大河北骄傲！
1,我们河北雾霾养的铁肺不是白养的！肺炎你少来！滚！！
1,既然武汉人不愿意封城     一直出来瞎溜达那就把别的省封了吧求求武汉人别串亲戚了没有地域黑是真的害怕啊都出来这种事了    老实呆着不好吗心里咋想的善良一点不好吗？
1,72岁的老爷子了。。。骂又不能骂，再被人道德绑架。石家庄人是抗住了，您武汉人直接过来，我。。。
1,已经543例了，这还只是爆出来的
1,河北人颤颤发抖
1,？72岁1.18号从武汉来石家庄探亲？19号发热今天才22号？所以18号为什么还要出省探亲？怎么就这么亲啊？
1,这是和亲戚有多大仇啊。。。都是脑残吧。真是无语了
1,我超级害怕我超级害怕我超级害怕我超级害怕我超级害怕我超级害怕我超级害怕我超级害怕我超级害怕我超级害怕我超级害怕我超级害怕我超级害怕我超级害怕我超级害怕我超级害怕我超级害怕我超级害怕我超级害怕我超级害怕我超级害怕我超级害怕我超级害怕我超级害怕
1,不是17例？
1,求求大家，某宝上哪家的口罩能迅速发货，价格可观的啊，妈妈那一批群体，因为买不到口罩，和价格太贵就放弃购买了，天天把口鼻暴露在外，我真的慌了。
1,最初，没有人在意这场灾难，这不过是一场灾火，一次旱灾，一次传染病，一个物种的灭绝，一座城市的消失。直到这场灾难和每个人息息相关。（流浪地球）​​​
1,关键是好多中老年人，压根就不重视。跟他们说了好多遍，都快吵起来了才把口罩戴上。农村集市上戴口罩的人几乎没有，今天还在集市上看到一辆武汉牌照的车……怂的一批。有没有可能在电视上滚动播放，或者由相关部门跟三大运营商协调，发布预防的短信，要不然家里长辈跟农村是真的重视不起来……
1,可使用含氯的消毒剂消毒比如84‼️我觉得有必要提醒84和洁厕灵千万别混用呐‼️会中毒‼️‼️
1,能不能说一下湖北周边的地级市到底有多少例啊！单武汉就300多例，周边的地级市难道就黄冈可以报道，其他武汉周边地级市不配么
1,這不就是昨天的數據嗎？？？？
1,秦岭有哥在！不用怕！秦始皇陵陕西由我守护！陕西挺住！中国加油！！
1,注意安全，戴口罩出门，武汉加油吧，尽量避免走动，为了家人着想，尽量待在武汉，医护人员辛苦了，请给环卫工人免费配口罩吧，他们不论什么时候，都在为我们服务。
1,强烈要求封锁武汉城，不想过年面对武汉来的亲戚。这跟歧视毫无关系，还有两天就要过来了！支持的顶起来！
1,能不能说一下都是湖北哪里的吗湖北其他地区真的很慌
1,但凡那么几个憨批管住自己的b嘴不吃野味也不至于全国乃至全世界为他们善后
1,武汉死亡9例，湖北死亡17例，湖北省内武汉以外的究竟有哪些县市呢？剩下的死亡病例来自哪里呢？
1,出门一定要戴口罩勤洗手注意安全啊大家
1,到底几例
1,口罩啊啊啊价格还有货
1,重视啊重视
1,21号24时？
1,心痛！！
1,？？？不是444死17
1,保佑平安
1,？？？？不是17吗
1,疫情核心区域，是否可以考虑网格状环境消毒了。
1,封城吧，求求了，别老走动探亲了
1,别再增加了
1,可以关注一下一些武汉的病人无法却确诊的事吗？医院资源快要饱和了，必须才去有效措施。这个姐妹的家人无法确诊
1,愿平安
1,哎！天佑中华！加油！！！！！
1,上个月忽视不作为，结果酿成大错了吧
1,网络上事后诸葛亮太多了
1,那就是湖北省内其他城市差不多有100例，死亡8例，哪些城市是不是要播报下，周边城镇很多人都不够重视，口罩不戴，四处串门，走亲访友，每家每户几乎都有从武汉回来的
1,9例是21日24点，17例是22日20点，时间节点不一样。
1,湖北政府武汉政府办事太弱了。15名医护人员被感染不报也不重视！早重视起来早拿出魄力拿出政策防止疫情扩散疫情出市出省出国，该多好。对湖北政府武汉政府很失望。2会开好了政绩就好了？
1,治愈人数多了，希望大了很多了
1,望平安！
1,电视台应该强行插播预防病毒的提醒，像地震那样，不然农村真的很多老人都不当回事儿
1,湖北是不是只有武汉这一个城市？
1,希望国家可以对湖北增援！！！不要再指责武汉人吃野味了，这个时候应该同心协力共抗病毒不是吗？怎么能把自己人放到对立面，对立面是新型肺炎不是嘛？！
1,靠近新闻漩涡的中心，犹如灯下黑，是最容易被忽略的。呼吁关注湖北除了武汉以外的其他地方，如果武汉有9例死亡的话，说明湖北其他地方的形势不容乐观，可能更严重！
1,大G女孩真的得感谢这个病毒，是它救了她
1,武汉的旅游团退团，为什么是30号以后才能全退？那30号以前的那些人舍不得这个钱，又在潜伏期的话，不是又往外输送病毒了？
1,今年春节电影院去不了了，景点去不了了，老实在家看春晚吧，奋战在一线的白衣天使够辛苦了，愿早日消除病毒。还有，河北等地挺住。
1,不是17例？
1,求求关注一下武汉周边的城市！武汉9例，湖北省都17例了！其他城市医疗条件也没武汉好
1,湖北其它县市呢？？？？？？能不能通报一下啊！！！！！
1,领导也戴一下口罩吧
1,您为什么更昨天的数据？
1,现在363例，床位准备了上千个，那么多床位，怎么还有不收的？
1,我已经不想看到人数增加了
1,武汉新型冠状病毒的阴霾，唤起了人们对17年前SARS肆虐时期的记忆。其中，一种言论逐渐甚嚣尘上“不是我们战胜了非典，而是非典放过了我们。”甚至有人“预言”，武汉新型冠状病毒也将在相似的时间，以相同的方式划上句号。
1,想问下为什么海鲜市场能够正大光明的卖野味！？？？
1,一定会平安度过的
1,真的很希望多报道湖北其他城市的情况！！！确诊和疑似病例有多少！！！让大家真的重视起来啊，有很多亲戚邻居都是武汉回乡的，真的有点害怕啊
1,所以有81个湖北省非武汉市的感染，8个湖北省非武汉市的死亡能不能细化到市啊！
1,为什么只说武汉，湖北省其他市死的人数一天内死这么多，难道不应该重点关注嘛？
1,请求公布湖北省其他市的数据！！！！！
1,湖北省减武汉，确诊病例444减363，地方县市81例，今天也只报了黄冈和荆州，还有死亡人数17减9，那地方县市的8个人还没确诊就死了吗？这种话你们也好意思说？
1,武汉死亡9例，整个湖北死亡17例，为什么其他地级市（除黄冈）没有上报一例确诊的，这死亡的8例都是哪些地级市，湖北不是只有武汉哪?现在不通报，大家还是照样逛集市走亲戚，一点危机感都没有
1,借个地方，举报以下淘宝卖家贩卖野生动物1.爱美膳旗舰店2.京采泷庆食品专营店3.青稞牧场4.纯野味店5.美人松土特产6.山鲜调旗舰店7.乐昌人家8.聚狼优品9.东昊蓝孔雀养殖基地10.环鄱阳湖绿色生态馆11.淼淼养殖12.小刘珍禽野味13.原味农家14.珍鲜湾旗舰店希望有关部门查验一下，谢谢。
1,愿患者早日康复医务人员注意安全我们也要好好保护自己
1,治愈者的血清中会有病毒抗体吗？
1,一定要家人们重视起来了啊！！！！
1,不是17例死亡吗？人民日报数据滞后哦～
1,现在公开的湖北省死亡人数17除去武汉的12人就表示有5人是湖北其他市区的对吧？为什么之前一点都不报道湖北其他城市情况，整个湖北只有武汉吗
1,可能江苏太难了，病毒考不进来
1,能治愈吗？
1,能不能关心一下湖北省地级市的情况，这边才是最容易感染的地区。省长省委书记要不要出来讲讲？
1,中国加油！武汉加油！戴口罩戴口罩戴口罩戴口罩！别瞎吃别瞎吃别瞎吃别瞎吃！别乱跑别乱跑别乱跑别乱跑！尽量别去人多地方！
1,前期真的太不注意了导致现在这么泛滥
1,死亡17例？？？是我看错了吗怎么一下突然这么多啊
1,微博消息很及时，宣传很到位……但该让那些不玩微博得知道了
1,大家多给中老年人宣传一下，现在好多中老年都不相信疫情的严重性！很多人都不知道情况，跟他们普及也听不进去，觉得小题大做，电视多做普及吧，特别是三大运营商短信通知起码引起重视，又逢春运，人流密集，再不重视，不提前预防，更是让人担忧
1,请求湖北地级城市实时疫情透明化
1,17人了！不是开玩笑呢了！请求尽快将武汉作出强制限行措施、不是「建议」而且强制性管控、所有武汉出发前往经由的航班全部取消、高铁火车不经停通过。现在愈发严重了、春节每年都有、生命只有一次、共同抑制病情的扩散发展是当务之急！
1,我跟我妈说死了十几个了她说别说这些晦气的
1,我认为短信真的要安排上了，我们这里有人确诊了，但好多人不知道，我看见戴口罩的都是年轻人
1,最初，没有人在意这场灾难，这不过是一场灾火，一次旱灾，一次传染病，一个物种的灭绝，一座城市的消失。直到这场灾难和每个人息息相关。（流浪地球）​​​
1,我真的希望武汉封城，这个想法对于武汉人民来说很自私。但是不封城对于其他省份的人来说就公平吗？但凡其他省份得过病的都是去过武汉的或者是从武汉来的
1,感觉死亡率比“非典”还要高。重视程度还不够啊。三线城市很少有人戴口罩，很多公共区域没有安全提示。人们根本没有重视到这场疫情的严重性。国家应该加大宣传力度。
1,上午才9个人这会儿17个了？？？
