1,救救湖南吧，感染了两百多人了，但是一点都不重视！！！口罩也买不到！！到处走亲戚串门，打牌！！村干部看到根本不管啊
1,岳阳市医院物资严重短缺好多人都没口罩呀，能给关注下吗
1,请注意湖南农村，口罩清空，然后广播要求每天戴口罩，可是买不到啊买不到
1,救救湖南吧，岳阳这边真的很难
1,还是注意一下
1,大家都要健健康康平平安安
1,南无阿弥陀佛功德回向武汉消灾一切灾难。
1,我一直以来的疑问有答案了
1,你感冒好了还会感冒吗
1,抱歉，说个题外话，打扰一下。大家看看顺风某快递员干的事吧（并不指整个顺风公司，仅只那个发国难财的渣渣！），简直太恶劣了！！截下别人的口罩快递  发国难财！！真的恶劣！！！
1,那些吃野味卖野生动物的。妈的因为你们死多少人了死多少人了！多少家庭破碎了！中国经济损失多少了！其他国家怎么看中国了。祸害多少个国家了！妈的卒他们九族卒九族！！！
1,让治愈的患者做志愿者我觉得是个好主意
1,住我家隔壁的哥哥一个人在院子里拍篮球，连个篮筐都没有，拍了一个下午，感觉他要抑郁了....
1,希望不会，这样的罪一次就够，不然也遭不住哇。
1,二次感染概率低，但并不排除二次感染，病毒通过抗原感染细胞，浆细胞会产生记忆细胞，从而有效防止二次感染。
1,请问vc可以抗病毒吗中午央视专访童朝晖专家说可以但是我记得之前辟谣过呀
1,嗦以意思就是目前暂时安全却还有个但是……
1,我就希望不感染，还考虑不到二次感染这码事，我希望一次感染的人都好起来先
1,至于为什么我现在那么无聊刷微博，事情还得从那几个馋死的人为什么馋说起
1,湖南真的好惨，看看湖南吧
1,不要心大
1,一周了一到下午体温在37.2-37.5徘徊嗓子不疼稍微咳嗽一两声怎么办啊
1,我们这里已经开始放松警惕了，刚才我叔一家四口来我们家串门（都戴着口罩）吓死了，还说路上好多人都出来玩了说都憋坏了，安徽阜阳某小农村麻烦再加大宣传吧
1,从这些病人体中提取抗体做疫苗不行吗？
1,我躺在床上情绪失控16次，心脏跳动2671次，眼睛眨了589次，我实在想不通哪个沙雕为什么要吃野味？他想当场去世有很多办法，为什么要祸害我们，我们老百姓是无辜的啊
1,凡表态必肛！默默祈祷好消息
1,湖南湖南啊！！重视起来啊！
1,看胡编怎么编？
1,这个专家有点坑，真是经常和官员打交道，一套一套的太极拳，打的真好
1,一直以来都是人类把动物关进笼子。今年春节，动物成功地把十几亿人关进笼子。天道轮回，善待生灵！
1,既然不戴口罩，你咋还戴着呢，摘了
1,是真滴敢说
1,明天他的话要传满整个长辈朋友圈，长辈有理由不戴口罩了，好的这一个星期的念叨白费了
1,专家的意思是，室内需要带口罩，去超市还要带手套。但是室外不用带，因为空气流通。公共卫生问题不能脱离社会发展考虑，目前属于过度恐慌。说的都没错，为什么这么多人听不懂呢
1,喷子们来了  人家说话也不看完整我都服你们我觉得曾老说的很好  人家首席科学家多少人本科都不是就在那喷无知乱喷暴露智商
1,别再增了别再增了别再增了别再增了别再增了别再增了别再增了别再增了别再增了别再增了别再增了别再增了别再增了别再增了别再增了别再增了别再增了别再增了别再增了别再增了别再增了别再增了别再增了别再增了别再增了别再增了别再增了别再增了别再增了别再增了别再增了别再增了别再增了别再增了别再增了
1,老头喝多了吧
1,这个专家是官场上的人。这场直播没有实际意义
1,曾光的意见变化太快了，说话有点儿飘………
1,这个曾光不行啊，说话官腔一套一套的，最关键还说大街上不用戴口罩，好家伙，我该听李兰娟钟南山的，还是听你的啊？
1,他不是医生，在轻症的时候更合适居家隔离恢复。
1,人家说的是露天的地方不用戴口罩
1,意思是该感染就感染了
1,请问vc可以抗病毒吗中午央视专访童朝晖专家说可以但是我记得之前辟谣过呀
1,病毒忽悠局曾局长！敢与召忠齐名！
1,曾光都把之前的八个人视为事前诸葛亮为什么政府和有关部门还不出面给他们道歉给他们补偿为什么湖北省长省委书记和武汉市委书记还在职
1,8个英雄被说成造谣者，怎么处理的呢？
1,问题是中央空调，多少年才消毒一次？
1,都需要带手套了，那买的东西还能要吗？
1,你们就说北京怎么办吧
1,你让那8位事前诸葛亮拿出证据，那么你政府拿出证据证明那8位是造谣吗，拿人民的生命开玩笑，只要有传染的可能，你们的防御措施和观察验证期在哪，在那开4万人大联欢吗
1,17年，一个婴儿都足够接近成年了，可我们在某些方面成长的好慢!
1,喷子都是全能专家，什么都懂，真服了
1,接了个电话就胡说了
1,我看曾教授可改行做社会活动家或政治家
1,宣传武汉人民是受害者，那全国人民窝家里算什么？
1,曾光不太行啊……
1,老胡都听懵逼了
1,没必要戴口罩，为什么您在戴
1,冲他这么说大街上随便溜达没事啊？
1,在家宅不添乱
1,听专家的！
1,扯……业……砖……家……大……忽……悠，前后说法矛盾，逻辑不一致、还有点乱
1,老胡懵了哈哈哈哈
1,国家疾控中心，要汲取教训。这次疫情，前期研判失误，轻视了。
1,人家和你们都不是一个层次的  你们不懂很正常继续喷吧暴露自己的无知
1,这人找他来干嘛？医生听到这话会想打他吗？
1,看了，一线医疗工作者一直在强调，做好个人防护，带口罩，结果后方这些砖家说不带口罩也没事，让我想起了以前岳飞在前线打仗，后方秦桧暗中使坏，最后大宋亡了
1,这个人说话感觉没睡醒。。。。
1,看曾光也就图一乐，真学技术还得钟南山！！！
1,嗯？他在回答什么问题
1,又开始吹自己的厉害了
1,现在万众一心才是”心”
1,哈哈哈这个专家真的乱说话
1,大概意思就是生死有命富贵在天
1,死了这么多人大惊小怪？
1,这个专家把各级政府各部门劝导人们出门戴口罩的好做法抹了桌子，而自已却还戴着口罩坐而论道？
1,我觉得还是看李永乐老师讲冠状病毒的视频有收获。
1,为了维稳什么都敢说
1,王岐山都出来了
1,转发微博
1,国家有难，咱不添乱！坐在家里，就是贡献！亲戚不走，来年还有！朋友不聚，回头再叙！中国加油，武汉加油
1,这种场合不应该吹牛！
1,记得毛主席说过心齐方可成龙。
1,北京市某局长说“好多单位说口罩、测温枪都买不到，我觉得很快会缓解。说大家不要相信网上说的说无症状也会感染。最后说什么都不干了，休假那叫休息局好不好，让你在家测体温，万一有人不测呢，还是上班来测比较好。当年非典持续了6个月难道我们也要放假放六个月吗！”这么体贴的领导上哪找呀？！
1,我就想问问产检能不能去
1,求老胡的阴影面积
1,我真的请大家别喷了，不是杠精，我自己学医的，父母也都在部队医院参加过非典一线，我们都觉得专家说的很客观，室外通透环境口罩真没那么必须，像公园，室内才是最有必要的！比如超市，人流密集！大家不能心疼心疼这几位院士吗？
1,这就是疾控中心的领导，这是办实事的人吗？
1,这怕是个傻子吧
1,总结一下1.在大街上不需要戴口罩，但是到超市、商场、公交、地铁、火车、飞机等人员密集的公共场所需要戴口罩，必要时需要戴手套2.从非疫区返岗不用自我隔离，戴好口罩就可以。3.非疫区的人如果发烧或者其他严重疾病，应该立即到医院去，不用过于担心交叉感染。疫区的人如果发烧应按照统一战略部署
1,去医院不好！先去诊所！或者自己买药
1,我只相信钟南山，曾老话太官方了
1,冬天戴口罩上街，非常正常。这个砖家，只适合搬砖。他的谬论，会影响中央决策的。
1,怪不得没有尽早控制
1,【短评视频中，老伴给打电话的某专家表示空气良好时上街不用带口罩，以及从非武汉返回北京的人们也不用戴口罩！同时讲到可以去公园看病，必要时带手套！后被评论区吐沫淹没！老胡肠子悔青了！】
1,曾教授坐得不舒服的亚子
1,武汉加油！
1,新年第一首歌为武汉加油
1,武汉加油！！小李牛逼！！
1,建议疫情之后广电总局号召影视公司和演员把2003年的非典跟这次2020年的新冠状病毒肺炎分别改编拍摄成电影上映，纪念这两次战疫。更是提醒健忘的国人，以史为鉴，莫要再历史重演。支持的顶。
1,武汉加油！中国加油！
1,武汉加油中国加油
1,武汉加油，中国加油。
1,武汉加油，一切都会好的
1,火神山，雷神山，钟南山，三山齐聚克难关；国内捐，海外捐，李兰娟，众捐纷来达通途。男护士，女护士，前线人士，作战病毒中国勇士；医者心，仁者心，中国心，三心齐相聚。
1,武汉加油！中国加油！
1,武汉加油致敬逆行者
1,省长道歉的那条，敢不敢开评论？有错就是有错，错了不是该承担责任么？何必替他遮掩？
1,就算再艰难，爱不会离开！武汉加油！中国加油！
1,武汉加油！小李牛
1,第一次感觉人民日报好假
1,不知道说点什么只希望人民日报是为人民的
1,成都小李前来报道小李
1,武汉加油！中国加油！！
1,武汉加油，中国加油小李和隆隆真是太牛了
1,一人吃野味，全球都受罪。管不住B嘴，喂口屎堵嘴。
1,什么时候向8壮士道歉？？？？？？
1,武汉加油，武汉挺住加油
1,防控新冠肺炎事关每个人的身体健康和生命安全。8件事情要做好勤洗手、戴口罩、少聚会、多通风、忌野味、吃熟食、遵医嘱、莫恐慌。请大家增强自我防护，共同维护社会正常秩序。
1,武汉那条怎么看不到评论
1,为武汉应援的歌曲，武汉应援曲
1,鞠躬视频下，关闭了评论意义何在。
1,小李牛逼！中国加油！武汉加油！
1,当我听到第一句武汉加油的时候，眼泪一下子忍不住了。是啊，这个2020的春节我们经历了一些阴霾，但我们始终相信，困难面前，我们在一起就是最强的力量！武汉加油！中国加油！
1,好无聊咱继续打牌，三个蝙蝠带一对果子狸谁要？
1,中国加油！武汉加油！小李冲！
1,武汉加油中国加油
1,你是人民日报，1.08亿的关注，该为人民说话，为什么湖北省省长鞠躬道歉这条消息大家不能评论，人民有话要说，你却关闭了评论，没想带节奏，真的太气人了，连好好说话都不行了
1,中国会越来越好！
1,抗击疫情我们在一起武汉加油中国加油
1,关闭评论，意思就是不想吃良药了呗？
1,北京还能延长假期吗地铁火车站
1,火神山雷神山钟南山三山齐聚克难关
1,你有本事发微博，有本事别关湖北评论啊
1,武汉加油，中国加油！！！
1,不让人民发声，好意思叫人民日报？
1,省长道歉那一条居然不能评论，看看河南省长怎么做的吧
1,我从小吃到大的面，它叫热干面，我和同桌下课偷偷啃的鸭，它叫周黑鸭，我那年刻在桌子上的大学，它叫武大，梦里出现的樱花是武汉的樱花，诗里看到楼的是黄鹤楼，武汉，加油！
1,武汉加油！我们一直都在
1,武汉加油
1,武汉加油，我们在一起，一切都会好起来的
1,武汉加油中国加油
1,我们在一起
1,目前好像只能听MV
1,加油
1,感谢奋战在疫区一线的医务人员，人民警察，防疫人员，人民子弟兵，夜以继日工作的小汤山医院工程建设者，放弃休假连续加班的口罩厂员工！我们在过年，这群人在帮我们过关。隔离病毒，绝不是隔离爱。14亿人万众一心、众志成城，就没有我们过不去的坎！武汉加油！中国加油！
1,既然已经取消了人民在微博下评论的权利，表明了你不配称为人民的日报，殊不知百姓的言论在于疏而不在于堵。
1,小李隆隆
1,隔离病毒但不隔离爱武汉加油！
1,我们在一起，中国
1,武汉加油！我们在一起
1,武汉加油！我们在一起
1,武汉加油，我们在一起！
1,众志成城，我们与你一起度过这次难关，我还没去武汉吃热干面，还没看美丽的樱花，还有黄鹤楼等等漂亮的景点，吃好吃的美食，所以一定要挺过来，我们到时候一起在武汉相遇看看美丽的武汉，一定要加油！请记住我们一直都在为您们加油！也请医护人员保护好自己平平安安回来
1,武汉加油
1,武汉加油！但省长必须下台
1,删评来得及吗，来不及干脆全部精选评论了
1,处决湖北省长!
1,为什么要关闭评论极其失望透顶且愤怒
1,加油武汉！！！
1,加油！
1,相信明天会更好
1,致敬最美逆行者感恩有你们
1,武汉加油中国加油
1,共饮江水，共克时艰。执子之手，与子偕行。相将来日，樱花烂漫。
1,武汉加油中国加油
1,口罩买不到怎么办
1,真的也要保证上班族有足够的口罩
1,地铁上人挤人挤人挤人  那个密度可能需要三重口罩。。
1,买不到口罩！北京3号就要挤地铁！！！
1,求人民日报给我一个买口罩的链接每天都要出门上班而且我还是在医院上班我们医院一人一天就给一个口罩我出门回家都没口罩戴
1,骑车，走路，不现实
1,办公楼都是全封闭的中央空调一扇能开的窗都没有啊
1,买不到买不到买不到买不到买不到买不到买不到买不到买不到买不到买不到买不到买不到买不到买不到买不到买不到买不到买不到买不到买不到买不到买不到买不到买不到买不到买不到买不到买不到买不到买不到买不到买不到买不到买不到买不到买不到买不到买不到买不到买不到买不到买不到买不到买不到买不到
1,只能说非常的理想化……
1,北京步行上班？
1,建议过于理想化。上海各地延迟到2.10上班，真正落实的企业有多少？被迫返岗，没有口罩酒精，如何自我防护？外地返回居家观察岂不是画蛇添足多此一举，意义何在？一线城市办公楼人口密度大，中央空调，电梯拥挤，就餐集聚，如何控制？
1,在中国只要上班，这些建议就是空话
1,为什么不能延迟上班呢？被感染了怎么办？上班族的命不是命么？
1,还没上班呢，同事已经在问我有没有口罩怎么办？没有口罩可以在家办公吗？
1,步行？坐车30分钟，步行2个小时，你步行给我看看，真的是
1,居家隔离为啥还要返回？？？？？？脑子有问题？？？？？
1,单位怎么可能允许让隔离两周。
1,不坐公交地铁到公司已经下班了
1,就不应该返岗！
1,买不到口罩啊
1,我上班坐车都要一个小时，步行大概就天黑了
1,坐地铁都一个多小时你让我步行、汽车上班？？
1,从我住的地方到公司骑车需要2个小时40分钟走路5个多小时能不能给点儿实际的建议
1,我们不是没有防护意识，口罩都支援武汉了，疫情不严重的地方都买不到，至少得保证工作岗位上的人有合格的口罩啊，连公司企业都找不到货了。非要等病例增加再实行必要措施吗？希望不要出现第二个武汉吧。能不出屋我们一定不出，必须出去的就看运气吧。无耐​​​
1,这是没上过班的做的建议吧
1,说那么多废话这时候不就应该全国放假么身体都保不住还谈什么未来的工作和生活
1,没有口罩，哪有口罩！我tm想辞职了
1,口罩买不到怎么办
1,这是北京回应的延期没戏的意思吗
1,所以北京到底延不延迟上班
1,非必要生产单位就不应该返岗！！！
1,少聚会是真的！！！
1,1.买不到口罩2.不得不使用公共交通3.合租房，怎么做好隔离防护4.公司整栋楼中央空调上有老下有小  实在没勇气这个时候赶着去上班
1,老百姓没有好的防护措施，各行业陆续上班就会面临更大的风险
1,少上一月班和暴发病毒，孰轻孰重？！现在的情况已经能说明问题，至少10号上班
1,您觉得可能吗？其中某几条可能实现吗？
1,所有口罩都捐给湖北，其他地区人民不配生存了吗，根本买不到口罩。
1,你们在赌嘛?万一返岗又出现大规模爆发怎么办???是在拿什么开玩笑?学生都延迟开学了   家长还要按期上班?那请问学生在家谁照料???
1,喝汤一样，这种形势下上班，一躺一片
1,顺丰已经开通了武汉捐赠的绿色通道，请有捐赠需求的朋友拨打95338专项电话与客服人员联系，请务必强调是救灾捐赠物资，经核实后会安排收寄。因为有人有物资没办法运送进去，顺丰开通了紧急通道很多人不知道祝大家新年快乐，打扰了。
1,口罩酒精什么都买不到，马上返京上班怎么办啊，救救我们吧，求放过，国难当前我们也不想给国家制造麻烦
1,口罩买不到，带口罩上班，少聚会，这就是个悖论
1,强烈建议，北京等超大城市延迟上班，要知道，人口密度和对公共交通的依赖程度，都是很难控制的，希望高层领导三思啊，上海做的就很好！
1,我感觉，在北京上下班挤公交，地铁就是参加集体活动
1,后天就要回公司了，其实真的挺害怕的
1,能不能身份证单双号限行
1,这些都是给那些办公室人员的建议，那那些工厂普工怎么搞？
1,比如2.8上班，2.7返回后先隔离14天？公司答应吗…
1,合租乱+地铁人贴人+百人办公室口罩又难买用一个少一个。来，您要不也来试试？
1,跟放屁没什么区别
1,只要正常上班，就没有办做到以上这些
1,小编你写的这么详细  图文并茂的不如你先给我们示范一下吧   地铁的话就北京1号线吧10站   公交的话300外16站  骑车的话西三环骑到东三环21公里单独隔离的话上班就是5个人的集体宿舍没有杠   我最真实的上班路线   我有同事还是通州到东三环
1,说实话！村封了！路封了！车停了！想返回工作岗位都没有办法返回，出行已无解，公司也未通知延长假期。这下尴尬了要钱不要命还是要命不要钱二选一的选择总是会来勿喷​​​
1,买不到口罩！买不到口罩！买不到口罩！买不到口罩！买不到口罩！买不到口罩！买不到口罩！买不到口罩！买不到口罩！买不到口罩！买不到口罩！买不到口罩！买不到口罩！买不到口罩！
1,也得能买得到口罩啊
1,不是不戴是买不到口罩
1,从外地返回，居家观察两周，那我回去干嘛？
1,有资格参照这些建议并且有条件采用的都还不用去上班
1,初三就在上班买不到口罩买不到酒精
1,能给点现实的措施吗？？？？？
1,都废话吧
1,不是说好了延迟上班么？为什么我们公司还没通知。
1,我们现在最关心的是口罩问题，还有是否应该延期上班？
1,还不如不上班
1,延迟吧，真的，国家别冒这个险了。
1,我买的太空服，质量还可以，并且出门回头率该挺高的，也不用担心在北京挤地铁了
1,买不到口罩怎么上班？坐公交1小时的路程。办公室室里也要戴口罩？没有怎么带啊
1,没地方买口罩
1,我觉得最有效的建议就是推迟上班时间等疫情结束再上班！同意的赞我！
1,新疆这边已经买不到口罩了
1,戴口罩出门买口罩口罩没买到还损失一个口罩
1,一人吃野味，全球都受罪。管不住B嘴，喂口屎堵嘴。
1,希望能赶紧让普通民众也能买到口罩
1,我还是买不到
1,武汉那个领导说多少来着？
1,提一个建议。这次疫情过后，请把华南海鲜市场夷为平地，原址建设武汉2019-nCoV病毒感染事件受害者纪念馆，记录2020年初发生的大事。将因感染致病的案例展示出来。作为向公众教育之用，希望再没有人吃野味。两次了，有点记性吧
1,普通民众最好的办法就是不出门，不出门就可以减少口罩使用。
1,我到今天还没买到口罩，药店没货，网上不敢买
1,淘宝好多假口罩，注意防范啊
1,中国可是14亿人
1,坐标江苏买不到口罩啊前几天买了几包今天发现是假冒伪劣产品
1,口罩生产真快，可是为什么我们好多人还是买不到？？？真的该去彻查一下淘‖宝的店铺，十只口罩卖到50多远已经是便宜的了，更便宜的根本买不到
1,等疫情过去，我一定要买点医用外科口罩！把我气死，一个都没有买到，到时买来看看这货长啥样！
1,800万
1,没有口罩2月3号怎么上班！！！
1,没事别出门，不出门不浪费口罩，好给前线的医护人员和为了中国此时能正常运转的工作者用！！！！！
1,请大家关注一下重庆吧，重庆九龙坡区、重庆大渡口区、重庆市中医院、开州区人民医院、奉节人民医院，急需抗击新型肺炎防护物资，望扩散
1,供应给武汉后，那剩余的其余地方的货源能供应一下吗没有口罩，买不到，不敢出门
1,每出门采购一次口罩，消耗家里库存1只。每次限买3只。买到了，赚2只；买不到，亏1只。老张家里原有库存10只，出门10次之后，家里现有12只。请问，他有几次出门是买到口罩的？
1,这天下终究是姓复的前排复制党玩够了吗
1,我们缺的不是防疫知识，是口罩，酒精！
1,这时候就不应该再投入市场了，应该国家买下来，由各地方的防疫站统一发放，优先确保医院供应。其次在车站机场等公共场合免费限量发放。最后进社区、村镇，各单位发放。
1,因为没有口罩，超市和菜市场都进不去
1,14亿人都想买
1,一次性口罩可以用电吹风最高档吹10分钟，有效杀死病毒
1,要开始上班了，一个口罩都没有怎么办？？那么多口罩都拿去支援武汉了，有没有想过其他地区？
1,不出门口罩就可以省点用了
1,我们也买不到啊
1,今天走了八家店都买不到还亏了两个
1,108亿只
1,吃野味的biss
1,全民没口罩，国家心有余力不足，市场经济的弊端，口罩要例入储备管控
1,中国应该加强口罩
1,在一个月前，怎么也想不到口罩会等同于柴米油盐。
1,哎，重庆急需急需急需急需急需急需急需急需急需急需急需急需急需急需急需急需急需急需急需！！！！！
1,一天八百万，复工上班之后光是北京都不够。
1,口罩紧张，蔬菜也紧张。而且我们山东的蔬菜也涨了，自己家的蔬菜往外送，再苦再难也要帮助兄弟省份！给山东点赞
1,先保医生
1,普通市民根本买不到口罩啊
1,我们这根本买不到，一个口罩用了都舍不得扔
1,留学生超过一万人，学校给每个留学生发两包口罩，一天就要发放两万包口罩拿来这么多呢？从红十字会那边调的吗？但是红十字会的物资是全国人民捐给医生，病人的！！！为什么要给留学生一想到雷神山前几天还在募捐。。。whzf你没有❤️
1,为啥国家平时不将医疗物资用做战略储备，这东西可比粮食好保存多了
1,到目前我真的连口罩都还没有一个！
1,我今天还在我朋友圈看到说自己口罩用不完的惊呆了
1,就这武汉的外国留学生手里一人一天八只呢
1,关键啥时候能让普通老百姓能买到
1,口罩厂招工人吗，管吃就行，不想写论文，只想为国家做贡献
1,今天早晨六点多去某合堂药店问有没有口罩，看到门口在卸货，门口刚卸下来一大箱一次性口罩，当时看到这么多口罩我的眼睛都蓝了，进去问，来口罩了？店员说没有，我指着说那门口那一箱不就是吗？店员说那是别人预定的马上就送走。我道行浅，谁能告诉我这是什么操作？
1,买不到   所以宅
1,留学生每人每天发八个
1,我的置顶微博，我在这干着急。
1,发给留学生了呗
1,康康武汉留学生一天八个根本不愁
1,我国口罩最大产能才2000万，十几亿人，再加上口罩要更换，就算是全球生产都不够啊能不出门就不出门，能重复利用就重复利用，减少口罩使用次数，口罩是真的真的不够用​​​
1,节约口罩没事不出门！！没去人流量大的地方，口罩可以再使用（疫情不严重的地方）
1,顺丰那个快递人员还来个顺到截胡
1,我想问问现在普通的一次性口罩，2元一个算贵呢？？？
1,昨天听说政府在定点药店发放口罩，每个药店3000多只，去了全部都没了
1,没事少出门，虽然口罩能防止你感染病毒，但病毒会附身在衣物上，回到家里不可能戴口罩，这会导致家庭式感染。
1,群众的防范意识是上来了，就是口罩太难买了。
